Data Atualização,Nome da Forma de Abastecimento,Código da SAC ou SAA com captação subterrânea,Municípios Rio Grande do Sul,Coordenadoria Regional de Saúde (CRS),Municípios RS (Cópia),População estimada Abastecida,Data da Inspeção,Tipo de Abastecimento,Possui Responsável Técnico?,Nome Completo do Responsável Técnico,A Forma de Abastecimento Possui Tratamento?,Análises de Vigilância - Cloro Livre Residual menor que 0,2mg/L,Nome Completo,Cargo/Função,Órgão/Instituição (CRS ou Município),Equipe de Inspeção,Data de Entrega do Relatório de Inspeção,Incluir Relatório em PDF
2017-06-01 12:37:27,SAC,,São Valentim,11,,40,01/06/2017,SAC,NÃO,,NÃO,SIM,EVANDRO MENEGHETTI,FISCAL TRIBUTÁRIO, SANITÁRIO E DE MEIO AMBIENTE,PREFEITURA MUNICIPAL DE SÃO VALENTIM/SECRETARIA MUNICIPAL DE SAÚDE/DEPARTAMENTO DE VIGILANCIA SANITÁRIA,,,5816796_448114.pdf
2017-06-06 13:57:37,Muliterno 2244659,,Muliterno,6,,1899,06/06/2017,SAC,SIM,samuel fornari,SIM,NÃO,Ailton Cezar de Oliveira,fiscal sanitario e ambiental ,secretaria municipal de saude muliterno ,,,
2017-06-07 09:27:28,SAC NOVA VENEZA,,Severiano de Almeida,11,,79,31/05/2017,SAC,SIM,Vera L. P. Dal Pupo,SIM,NÃO,Alan Junior Solivo,Fiscal Sanitário,Secretaria Municipal de Saúde,,06/06/2017,5835571_448114.pdf
2017-06-07 13:53:41,CRUZALTENSE SEDE,,Cruzaltense,11,,315,30/05/2017,SAC,SIM,JEAN CARLOS MERG,SIM,SIM,VAGNER SANDRI,FISCAL AMBIENTA/SANITÁRIO/ URBANISMO,SECRETARIA MUNICIPAL DE SAUDE,,07/06/2017,5837736_448114.pdf
2017-06-09 11:01:30,SAC LINHA VOLTA GRANDE,,Barão de Cotegipe,11,,109,31/05/2017,SAC,SIM,VERA LÚCIO PIZZI DAL PUPO,SIM,NÃO,Silvana Trierveiler,COORDENADORA VISA,SECRETARIA  MUNICIPAL DE SAÚDE,,09/06/2017,5846931_448114.docx
2017-06-12 09:45:22,Souza Ramos,,Getúlio Vargas,11,,206,01/06/2017,SAC,NÃO,,NÃO,SIM,Jean P Soccol,Coordenador Vigilancia Sanitária,Secretaria Municipal de Saúde,,,5851317_448114.pdf
2017-06-12 11:21:38,SAC SÃO PEDRO 1,,Marcelino Ramos,11,,27,06/03/2017,SAC,NÃO,,NÃO,,RENATO DA CONCEICAO,FISCAL SANITÁRIO E DE MEIO AMBIENTE,SECRETARIA DA SAÚDE,,12/06/2017,5852252_448114.pdf
2017-06-14 08:24:44,SAC- LINHA DALBOSCO/ INTERIOR,,Entre Rios do Sul,11,,116,01/06/2017,SAC,SIM,ALVARO LUIZ MALVESTI,SIM,SIM,ISAIAS CASSIANO SECCO,FISCAL SANITÁRIO,SECRETARIA MUNICIPAL DE SAÚDE,,14/06/2017,5861043_448114.pdf
2017-06-19 09:55:29,COMPANHIA RIOGRANDENSE DE SANEAMENTO,,Jaguari,4,,8000 ,16/02/2017,SAA,SIM,JARGER DA ROSA SILVA,SIM,NÃO,ELISANGELA BOLZAN,FISCAL AMBIENTAL E SANITARIA,PREFEITURA DE JAGUARI RS ,,,
2017-06-20 14:31:09,Comunidade de linha tansini,,Floriano Peixoto,11,,150,31/05/2017,SAC,SIM,Alvaro Luis Malvesti,SIM,SIM,Vanusa Zorzeto,Fiscal Sanitário e De Meio Ambiente,Prefeitura Municipal,,20/06/2017,5881049_448114.pdf
2017-06-21 08:49:42,SAC TOPE DA SERRA,,Faxinalzinho,11,,60 ,01/06/2017,SAC,SIM,Vera Lucia P. Dal Pupo,SIM,SIM,SABRIELI DE LIMA CAERAN,VIGILÂNCIA SANITÁRIA,UNIDADE BÁSICA DE SAÚDE,,02/06/2017,5883842_448114.pdf
2017-06-21 10:28:28,SAA CORSAN PEJ 02,,Pejuçara,17,,3.151,19/06/2017,SAA,SIM,PLUTARCO ARISTIDES GERMANO SOARES MARQUES,SIM,NÃO,FRANCIS BISOGNIN,FISCAL SANITÁRIO E AMBIENTAL,PREFEITURA MUNICIPAL DE PEJUÇARA,,21/06/2017,5885032_448114.pdf
2017-06-21 13:21:42,POÇO VILA PALMEIRA FERREIRA,,Benjamin Constant do Sul,11,,148,31/05/2017,SAC,SIM,VERA LUCIA PIZZI DAL PUPO,SIM,NÃO,NATALIE FERREIRA NAZARI,COORDENADORA DE VIGILANCIA SANITÁRIA,SECRETARIA MUNICIPAL DE SAÚDE,,05/06/2017,5886549_448114.docx
2017-06-21 15:25:36,Comunidade de Linha Vanini Baixo,,Floriano Peixoto,11,,43,12/06/2017,SAC,SIM,Alvaro Luis Malvesti,SIM,NÃO,Vanusa Zorzeto,Fiscal Sanitário e De Meio Ambiente,Prefeitura Municipal,,21/06/2017,5887684_448114.pdf
2017-06-21 16:12:03 (2017-06-21 16:05:28),SOCIEDADE ABASTECEDORA DE AGUA COLINAS,,Colinas,16,,1100,14/06/2017,SAC,SIM,Edu Ricardo Beltrame,SIM,NÃO,Fabio Oscar Schardong,Supervisor de Sanidade Animal,Sec. Municipal do Meio Ambiente,,21/06/2017,5888144_448114.pdf
2017-06-21 16:14:20 (2017-06-21 15:51:46),SOCIEDADE ABASTECEDORA DE AGUA COLINAS,,Colinas,16,,1100,14/06/2017,SAC,SIM,Edu Ricardo Beltrame,SIM,NÃO,Fabio Oscar Schardong,Supervisor de Sanidade Animal,Secretaria Municipal do Meio Ambiente,,21/06/2017,5887974_448114.pdf
2017-06-21 16:21:34,SOCIEDADE DE ÁGUA LINHA BEIJA FLOR,,Colinas,16,,91,14/06/2017,SAC,SIM,Edu Ricardo Beltrame,SIM,NÃO,Fabio Oscar Schardong,Supervisor do Setor se Sanidade Animal,Secretaria Municipal do Meio Ambiente,,21/06/2017,5888285_448114.pdf
2017-06-21 16:25:14,SOCIEDADE DE ÁGUA LINHA ANO BOM,,Colinas,16,,373,14/06/2017,SAC,SIM,Edu Ricardo Beltrame,SIM,NÃO,Fabio Oscar Schardong,Supervisor do Setor se Sanidade Animal,Secretaria Municipal do Meio Ambiente,,21/06/2017,5888319_448114.pdf
2017-06-21 16:27:53,SOCIEDADE LINHA 31 DE OUTUBRO,,Colinas,16,,123,14/06/2017,SAC,SIM,Edu Ricardo Beltrame,SIM,NÃO,Fabio Oscar Schardong,Supervisor do Setor se Sanidade Animal,Secretaria Municipal do Meio Ambiente,,21/06/2017,5888342_448114.pdf
2017-06-21 16:30:27,REDE DE ÁGUA DA LINHA WESTFALIA,,Colinas,16,,111,14/06/2017,SAC,SIM,Edu Ricardo Beltrame,SIM,NÃO,Fabio Oscar Schardong,Supervisor do Setor se Sanidade Animal,Secretaria Municipal do Meio Ambiente,,21/06/2017,5888365_448114.pdf
2017-06-21 16:32:46,SOCIEDADE DE ÁGUA LINHA BEIJA FLOR,,Colinas,16,,91,14/06/2017,SAC,SIM,Edu Ricardo Beltrame,SIM,NÃO,Fabio Oscar Schardong,Supervisor do Setor se Sanidade Animal,Secretaria Municipal do Meio Ambiente,,21/06/2017,5888392_448114.pdf
2017-06-21 16:34:26,SOCIEDADE DE ÁGUA LINHA ANO BOM ALTO,,Colinas,16,,174,14/06/2017,SAC,SIM,Edu Ricardo Beltrame,SIM,NÃO,Fabio Oscar Schardong,Supervisor do Setor se Sanidade Animal,Secretaria Municipal do Meio Ambiente,,21/06/2017,5888405_448114.pdf
2017-06-22 08:47:34,POÇO AJU2 (CORSAN),,Ajuricaba,17,,4200,05/06/2017,SAA,SIM,RAFAEL POMPILHO,SIM,NÃO,MARGARETE ISEPPI,FISCAL SANITARIO,SECRETARIA MUNICIPAL DE SAUDE DE AJURICABA,,22/06/2017,5889810_448114.pdf
2017-06-22 09:02:20 (2017-06-22 08:41:22),POÇO AJU2 (CORSAN),,Ajuricaba,17,,4200,05/06/2017,SAA,SIM,RAFAEL POMPILHO,SIM,NÃO,MARLI TERESINHA BRIGO AYRES BUENO,FISCAL SANITARIO,SECRETARIA MINUCIPAL DE SAUDE DE INHACORA,,22/06/2017,5889758_448114.pdf
2017-06-22 10:22:37,PTP Associação Linha Inocente,,Estação,11,,33,01/06/2017,SAC,SIM,Vanessa Dos Santos Ritter,SIM,SIM,Kelin Vechiatto,Agente de Fiscalização,Secretaria Municipal de Saúde,,22/06/2017,5890773_448114.pdf
2017-06-23 10:35:41,SAC LINHA RIO PADRE,,Quatro Irmãos,11,,31,24/05/2017,SAC,SIM,Alvaro Luis Malvesti,SIM,SIM,Taisa Federle Alves Ferreira,Coordenadora Geral/ Veterinaria,Secretaria Municipal de Saude,,23/06/2017,5895720_448114.pdf
2017-06-23 10:41:38,SAC São Pedro,,Erval Grande,11,,78 ,30/05/2017,SAC,SIM,Alvaro Luis Malvesti,SIM,NÃO,Fernanda Fernandes,Vigilante Ambiental,Secretaria Municipal de Saúde,,23/06/2017,5895784_448114.pdf
2017-06-23 14:18:33,LINHA ACAMPAMENTO  01,,Três Arroios,11,,8 ,26/05/2017,SAC,SIM,VERA LUCIA DAL PUPO,SIM,NÃO,VALDIR BONI,FISCAL SANITÁRIO,SECRETÁRIA DE SAÚDE,,02/06/2017,
2017-06-26 08:59:26,LINHA GRAMADO,,Barão de Cotegipe,11,,56,08/06/2017,SAC,SIM,VERA LÚCIA RIZZI DAL PUPO,SIM,NÃO,Silvana Trierveiler,CORDENADORA DA VISA,SECRETARIA MUNICIPAL DE SAÚDE,,26/06/2017,5900844_448114.docx
2017-06-26 10:16:25,POÇO AJU2 (CORSAN),,Ajuricaba,17,,4200,05/06/2017,SAA,SIM,RAFAEL POMPILHO,SIM,NÃO,ELIAS SERAFIM LINDORFER,auxiliar administrativo,SECRETARIA MUNICIPAL DE SAUDE DE AJURICABA,,26/06/2017,5901932_448114.pdf
2017-06-26 10:24:47,POÇO AJU2 (CORSAN),,Ajuricaba,17,,4200,05/06/2017,SAA,SIM,RAFAEL POMPILHO,SIM,NÃO,BENJAMIN VERNER TOMM,AGENTE AMBIENTAL,SECRETARIA MUNICIPAL DE SAÚDE DE  NOVA RAMADA,,26/06/2017,5902042_448114.pdf
2017-06-27 10:44:16,Centro de Triagem e Resíduos,,Panambi,17,,6,23/06/2017,SAC,NÃO,,SIM,SIM,Loreni Dessbesell Windmoller,Fiscal Vigilância Sanitária,Secretaria Municipal da Saúde,,27/06/2017,5910925_448114.pdf
2017-06-27 13:26:29,Associação Comunitária Linha Colônia Casch,,Condor,17,,90,16/06/2017,SAC,NÃO,,NÃO,NÃO,Aguimar Ferraz,Agente Ambiental,cias - condor rs,,27/06/2017,5912846_448114.pdf
2017-06-27 15:30:15,PTP Caixa D Agua Garlet,,Estação,11,,74,23/06/2017,SAC,SIM,Vanessa Dos Santos Ritter,SIM,SIM,Kelin Vechiatto,Agente de Fiscalização,Secretaria Municipal de Saúde,,27/06/2017,5914801_448114.pdf
2017-06-27 15:42:31,SAC,,Nonoai,11,,48 ,12/06/2017,SAC,SIM,Marines Nodari,SIM,NÃO,Rosania da Silva,Fiscal Sanitário,Secretária Municipal de Saúde ( Prefeitura Municipal),,27/06/2017,5915016_448114.doc
2017-06-29 16:53:35,trilha agente jovem SAC,,Augusto Pestana,17,,460,26/06/2017,SAC,SIM,Paulo Roberto Aguiar Gonçalves,SIM,NÃO,Luciana Ferreira Zilke,Fiscal sanitário e ambiental,Prefeitura Augusto Pestana / Sec. Mun. Saúde,,,
2017-06-30 09:22:41,Comunidade de  Linha Vanini Alto,,Floriano Peixoto,11,,49,12/06/2017,SAC,SIM,Alvaro Luis Malvesti,SIM,SIM,Vanusa Zorzeto,Fiscal Sanitário e De Meio Ambiente,Prefeitura Municipal,,30/06/2017,
2017-06-30 16:28:55,PTP STRADIOTTO,,Estação,11,,30,23/06/2017,SAC,SIM,Vanessa Dos Santos Ritter,SIM,SIM,Kelin Vechiatto,Agente de Fiscalização,Secretaria Municipal de Saúde,,30/06/2017,5943156_448114.pdf
2017-07-01 00:51:14,A C BOZANO,,Bozano,17,,664,19/06/2017,SAC,NÃO,,SIM,NÃO,IVAN CAZALI,VIGILANTE EM SAÚDE E MEIO AMBIENTE,SECRETARIA MUNICIPAL DE SAÚDE,,30/06/2017,5945231_448114.pdf
2017-07-03 14:27:31,POÇO TUBULAR ESCOLA AGRICOLA,,Áurea,11,,242,29/05/2017,SAC,SIM,MARINES NODARI,SIM,SIM,JOSIMAR SKOVRONSKI,FISCAL SANITARIO,MUNICIPIO DE ÁUREA,JOSIMAR SKOVRONSKI = FISCAL SANITÁRIOVAGNER MAGAIEVSKI = FISCAL SANITÁRIO,03/07/2017,5949565_448114.pdf
2017-07-04 08:28:10,SAC ESCOLA BARÃO HIRSCH,,Jacutinga,11,,38,31/05/2017,SAC,SIM,AVARO L. MALVESTI,SIM,SIM,DANIELI AIMI,FISCAL AMBIENTAL E SANITÁRIO,SECRETARIA DE MEIO AMBIENTE,Danieli Aimi  -  Fiscal Ambiental e Sanitário,02/06/2017,5952309_448114.pdf
2017-07-04 09:07:53,Cruzaltense - 2,,Cruzaltense,11,,315,30/05/2017,SAC,SIM,JEAN CARLOS MERG,SIM,SIM,VAGNER SANDRI,FISCAL AMBIENTA/SANITÁRIO/ URBANISMO,SECRETARIA MUNICIPAL DE SAUDE,Adriane Boniatti ( Chefe de Serviços de Vigilância Sanitária)Vagner Sandri ( Fiscal Ambiental/Sanitário e Urbanismo),04/07/2017,5952670_448114.pdf
2017-07-04 14:12:34,SAA,,Catuípe,17,,6716,29/06/2017,SAA,SIM,,SIM,NÃO,FERNANDA BERTOLDO,AGENTE DE ENDEMIAS,SECRETÁRIA MUNICIPAL DE SAÚDE,Fernanda BertoldoElianePhilippCarlos A. Meneghini,03/07/2017,
2017-07-04 15:51:55,Comunidade de Mopnte Belo,,Sede Nova,17,,74,27/06/2017,SAC,NÃO,,NÃO,SIM,Juares Zanella de Jesus,Fiscal Sanitário,Secretaria Municipal de Saúde,Juares Zanella de Jesus - Fiscal SanitárioMárcio José Wolfart - Cargo de Confiança,03/07/2017,5956435_448114.docx
2017-07-04 16:18:13,Comunidade De Rosário,,Floriano Peixoto,11,,55 ,12/06/2017,SAC,SIM,Alvaro Luis Malvesti,SIM,NÃO,Vanusa Zorzeto,Fiscal Sanitário e De Meio Ambiente,Prefeitura Municipal,Agente De Combate a Endemias,04/07/2017,5956676_448114.pdf
2017-07-11 08:50:37,SAC AEROPORTO CMTE. KRAEMER,,Bagé,7,,40,23/06/2017,SAC,SIM,LUIS HENRIQUE PACHECO CORRÊA,SIM,SIM,DANIEL AUGUSTO CORRA TEIXEIRA,AGENTE DE COMBATE A ENDEMIAS,SERETARIA MUNICIPAL DE SAÚDE E APOIO À PESOA COM DEFICIÊNCIA,DANIEL TEIXEIRA-AGENTE DE ENDEMIASCLÉBER VILMAR MORAES-AUX. DE SANEAMENTO,10/07/2017,5983648_448114.pdf
2017-07-12 10:27:15,SAC-LINHA 2 PAULO BIASI,,Barão de Cotegipe,11,,16 ,07/07/2017,SAC,NÃO,,NÃO,,Silvana Trierveiler,COORDENADOR DA VISA,SECRETARIA MUNICIPAL DE SAÚDE,SILVANA TRIERVEILER- COORDENADORAMARCOS BEVILAQUA- FISCAL SANITÁRIO,12/07/2017,5990670_448114.pdf
2017-07-12 10:30:02,ASSOCIAÇÃO COMUNITÁRIA SÃO FRANCISCO,,Independência,14,,23 ,11/07/2017,SAC,NÃO,,NÃO,SIM,KLEBER JUNG,ENFERMEIRO/VIGILÂNCIA EM SAÚDE,SECRETARIA MUNICIPAL DE SAÚDE,KLEBER JUNG - ENFERMEIRO,27/07/2017,5990696_448114.pdf
2017-07-13 07:24:12,ASSOCIAÇÃO COMUNITÁRIA ESQUINA BOA VISTA,,Independência,14,,46 ,11/07/2017,SAC,NÃO,,SIM,SIM,KLEBER JUNG,ENFERMEIRO/VIGILÂNCIA EM SAÚDE,SECRETARIA MUNICIPAL DE SAÚDE,KLEBER JUNG - ENFERMEIRO,27/07/2017,5994666_448114.pdf
2017-07-13 07:56:19,LINHA VACA MORTA,,Três Arroios,11,,21,21/06/2017,SAC,SIM,VERA LUCIA DAL PUPO,SIM,SIM,VALDIR BONI,FISCAL SANITÁRIO,SECRETÁRIA MUNICIPAL  DE SAUDE,VALDIR BONI,13/07/2017,
2017-07-13 08:04:23,LINHA NAPOLEÃO,,Três Arroios,11,,87,23/06/2017,SAC,SIM,VERA LUCIA DAL PUPO,SIM,SIM,VALDIR BONI,FISCAL SANITÁRIO,SECRETARIA MUNICIPAL DE SAUDE,VALDIR BONI FISCAL SANITÁRIO,13/07/2017,
2017-07-13 08:09:30,LINHA SÃO DOMINGOS,,Três Arroios,11,,36,03/07/2017,SAC,SIM,VERA LUCIA DAL PUPO,SIM,SIM,VALDIR BONI,FISCAL SANITÁRIO,SECRETARIA MUNICIPAL DE SAUDE,VALDIR BONI FISCAL SANITÁRIO,13/07/2017,
2017-07-13 08:39:00,LINHA POÇO GRANDE,,Três Arroios,11,,42,30/06/2017,SAC,SIM,VERA LUCIA DAL PUPO,SIM,SIM,VALDIR BONI,FISCAL SANITÁRIO,SECRETARIA MUNICIPAL DE SAUDE,VALDIR BONI FISCAL SANITÁRIO,13/07/2017,
2017-07-13 09:28:33,FONTE VALE VITÓRIA,,Barão de Cotegipe,11,,40 ,07/07/2017,SAC,NÃO,,NÃO,SIM,Silvana Trierveiler,COORDENADOR DA VISA,SECRETARIA MUNICIPAL DE SAÚDE,SILVANA TRIERVEILER-COORDENADORA DA VISAMARCOS BEVILAQUA-FISCAL SANITÁRIO,13/07/2017,5995457_448114.pdf
2017-07-13 09:47:50,Linha América,,Erechim,11,,61,05/06/2017,SAC,SIM,Vanessa Rita Ritter dos Santos,SIM,NÃO,Filomena Revers,Fiscal Sanitário e Meio Ambiente,Secretaria Municipal de Saúde,Filomena Revers - Viguagua Municipal ,13/06/2017,5995664_448114.pdf
2017-07-13 09:54:08,LINHA AURORA,,Erechim,11,,58,05/06/2017,SAC,NÃO,,NÃO,NÃO,FILOMENA REVERS,FISCAL SANITÁRIO E MEIO AMBIENTE,SECRETARIA MUNICIPAL DE SAÚDE,FILOMENA REVERS - VIGIAGUA MUNICIPAL,13/06/2017,5995732_448114.pdf
2017-07-13 09:57:45,LINHA BARRA FRIA,,Erechim,11,,29,16/06/2017,SAC,NÃO,,NÃO,NÃO,FILOMENA REVERS,FISCAL SANITÁRIO E MEIO AMBIENTE,SECRETARIA MUNICIPAL DE SAÚDE,FILOMENA REVERS - VIGIAGUA MUNICIPAL,26/06/2017,5995766_448114.pdf
2017-07-13 10:00:59,lINHA BATISTELA,,Erechim,11,,52,16/06/2017,SAC,NÃO,,NÃO,NÃO,FILOMENA REVERS,FISCAL SANITÁRIO E MEIO AMBIENTE,SECRETARIA MUNICIPAL DE SAÚDE,FILOMENA REVERS - VIGIAGUA MUNICIPAL,26/06/2017,5995801_448114.pdf
2017-07-13 10:06:13,ASSOCIAÇÃO DA ÁREA INDUSTRIAL 2,,Independência,14,,5,05/07/2017,SAC,NÃO,,NÃO,SIM,KLEBER JUNG,ENFERMEIRO/VIGILÂNCIA EM SAÚDE,SECRETARIA MUNICIPAL DE SAÚDE,KLEBER JUNG - ENFERMEIRO,27/07/2017,5995852_448114.pdf
2017-07-13 14:44:00,Linha Lageado Boco,,Carlos Gomes,11,,61,23/06/2017,SAC,SIM,Vera Lucia Pizzi Dal Pupo,SIM,SIM,Danieli Paula Potulski,Vigilante Sanitário,Secretaria Municipal de Saúde,Danieli Paula PotulskiVigilante Sanitário,10/07/2017,5998389_448114.pdf
2017-07-13 14:49:09,PTP Caixa D Agua Carteri,,Estação,11,,68,05/07/2017,SAC,SIM,Vanessa Dos Santos Ritter,SIM,NÃO,Kelin Vechiatto,Agente de Fiscalização,Secretaria Municipal de Saúde,,14/07/2017,5998450_448114.pdf
2017-07-13 14:55:42,ASSOCIAÇÃO AMIGOS DA ÁGUA,,Cruzaltense,11,,54,21/06/2017,SAC,SIM,JEAN CARLOS MERG,NÃO,SIM,VAGNER SANDRI,FISCAL AMBIENTA/SANITÁRIO/ URBANISMO,SECRETARIA MUNICIPAL DE SAUDE,ADRIANE BONIATTI (COORDENADORA DA VISA)VAGNER SANDRI (FISCAL AMBIENTAL/SANITÁRIO/URBANISMO,13/07/2017,5998525_448114.pdf
2017-07-13 14:56:15,ASSOCIAÇÃO COMUNITÁRIA SÃO MIGUEL,,Independência,14,,45,11/07/2017,SAC,NÃO,,NÃO,SIM,KLEBER JUNG,ENFERMEIRO/VIGILÂNCIA EM SAÚDE,SECRETARIA MUNICIPAL DE SAÚDE,KLEBER JUNG - ENFERMEIRO,27/07/2017,5998532_448114.pdf
2017-07-13 15:06:09,LINHA SEÇÇÃO A,,Cândido Godói,14,,,11/07/2017,SAC,NÃO,,NÃO,,VALDIR SACKS,FISCAL SANITARIO,VIGILANCIA SANITáRIA - SAUDE,VALDIR SACKS FISCAL SANITÁRIOJOSÉ DE SOUZA MATOS  AGENTE SANITÁRIO,11/07/2017,5998632_448114.doc
2017-07-13 16:07:50,ASSOCIAÇÃO ÁGUA POTAVEL VILA TIMBAUVA,,Cândido Godói,14,,140,12/07/2017,SAC,NÃO,,SIM,NÃO,VALDIR SACKS,FISCAL SANITARIO,VIGILANCIA SANITáRIA - SAUDE,VALDIR SACKS - FISCAL SANITÁRIOJOSÉ DE SOUZA MATOS - AGENTE SANITÁRIO,12/07/2017,5999219_448114.pdf
2017-07-13 16:07:55,ASSOCIAÇÃO ÁGUA POTAVEL VILA TIMBAUVA,,Cândido Godói,14,,140,12/07/2017,SAC,NÃO,,SIM,NÃO,VALDIR SACKS,FISCAL SANITARIO,VIGILANCIA SANITáRIA - SAUDE,VALDIR SACKS - FISCAL SANITÁRIOJOSÉ DE SOUZA MATOS - AGENTE SANITÁRIO,12/07/2017,5999222_448114.pdf
2017-07-13 16:31:41,ASSOCIAÇÃO ÁGUA POTAVEL ESQUINA UNIÃO,,Cândido Godói,14,,477,10/07/2017,SAC,NÃO,,NÃO,,VALDIR SACKS,FISCAL SANITARIO,VIGILANCIA SANITÁRIA - SAUDE,VALDIR SACKS FISCAL SANITÁRIO JOSÉ DE SOUZA MATOS AGENTE SANITÁRIO,10/07/2017,5999436_448114.pdf
2017-07-13 16:41:52,lLINHA LAJEADO LEÃO BAÚ,,Três Arroios,11,,33,30/06/2017,SAC,SIM,VERA LUCIA DAL PUPO,SIM,SIM,VALDIR BONI,FISCAL SANITÁRIO,SECRETARIA MUNICIPAL DE SAUDE,VALDIR BONI FISCAL SANITÁRIO,13/07/2017,
2017-07-14 08:19:55,Sede poço I - Igreja,,Nova Candelária,14,,245 ,05/07/2017,SAC,SIM,Alexandra Vergutz,SIM,NÃO,Luana Vanessa Schwarzer,Vigilância Sanitária,Prefeitura Municipal de Nova Candelária,Luana Vanessa Schwarzer = Vigilância Sanitária,06/07/2017,
2017-07-14 08:24:03,Sede Poço IV - gráfica,,Nova Candelária,14,,124,10/07/2017,SAC,SIM,Alexandra Vergutz,SIM,NÃO,Luana Vanessa Schwarzer,Vigilância Sanitária,Prefeitura Municipal de Nova Candelária,Luana Vanessa Schwarzer = Vigilância Sanitária,11/07/2017,
2017-07-14 14:00:49,lLINHA LAJEADO LEÃO,,Três Arroios,11,,39,10/07/2017,SAC,SIM,VERA LUCIA DAL PUPO,SIM,SIM,VALDIR BONI,FISCAL SANITÁRIO,SECRETARIA MUNICIPAL DE SAUDE,VALDIR BONI FISCAL SANITÁRIO,14/07/2017,
2017-07-14 14:07:54,LINHA LAJEADO ANTAS,,Três Arroios,11,,105,29/06/2017,SAC,SIM,VERA LUCIA DAL PUPO,SIM,SIM,VALDIR BONI,FISCAL SANITÁRIO,SECRETARIA MUNICIPAL DE SAUDE,VALDIR BONI FISCAL SANITÁRIO,14/07/2017,
2017-07-14 14:28:01,ASSOCIAÇÃO LINHA BELA VISTA,,Cruzaltense,11,,102,21/06/2017,SAC,SIM,JEAN CARLOS MERG,NÃO,SIM,VAGNER SANDRI,FISCAL AMBIENTA/SANITÁRIO/ URBANISMO,SECRETARIA MUNICIPAL DE SAUDE,Adriane Boniatti ( Coordenadora da Visa)Vagner Sandri ( Fiscal Ambiental/Sanitário/Urbanismo),14/07/2017,6003963_448114.pdf
2017-07-14 14:46:35,PTP Vista Alegre II,,Estação,11,,65,05/07/2017,SAC,SIM,Vanessa Dos Santos Ritter,SIM,SIM,Kelin Vechiatto,Agente de Fiscalização,Secretaria Municipal de Saúde,,17/07/2017,6004147_448114.pdf
2017-07-17 09:12:22,LINHA FELLIPI,,Mariano Moro,11,,43,30/05/2017,SAC,SIM,VERA LUCIA DALPUPO,SIM,NÃO,NILTON VENDRAME,FISCAL SANITÁRIO,SECRETARIA MUNICIPAL DE SAÚDE,NILTON VENDRAME - VIGIAGUA MUNICIPAL,14/06/2017,6008399_448114.pdf
2017-07-17 09:41:31,SEDE POÇO III-DUAS ESQUINAS,,Nova Candelária,14,,163,12/07/2017,SAC,SIM,Alexandra Vergutz,SIM,NÃO,Luana Vanessa Schwarzer,Vigilância Sanitária,Prefeitura Municipal de Nova Candelária,Luana Vanessa Schwarzer - vigilância sanitária,13/07/2017,
2017-07-17 09:42:31,LINHA LAJEADO GRUTA,,Três Arroios,11,,21,25/06/2017,SAC,SIM,VERA LUCIA DAL PUPO,SIM,SIM,VALDIR BONI,FISCAL SANITÁRIO,SECRETARIA MUNICIPAL DE SAUDE,VALDIR BONI FISCAL SANITÁRIO,17/07/2017,
2017-07-17 10:27:53,LINHA SANTA TEREZINHA,,Mariano Moro,11,,20,30/06/2017,SAC,SIM,VERA LUCIA DALPUPO,SIM,NÃO,NILTON VENDRAME,FISCAL SANITÁRIO,SECRETARIA MUNICIPAL DE SAÚDE,NILTON VENDRAME - VIGIAGUA MUNICIPAL,07/07/2017,6009121_448114.pdf
2017-07-17 10:52:59,ASSOCIAÇÃO LINHA CECCATO,,Cruzaltense,11,,51,21/06/2017,SAC,SIM,JEAN CARLOS MERG,NÃO,SIM,VAGNER SANDRI,FISCAL AMBIENTA/SANITÁRIO/ URBANISMO,SECRETARIA MUNICIPAL DE SAUDE,Adriane Boniatti ( Coordenadora da Visa)Vagner Sandri ( Fiscal Ambiental/Sanitario/Urbanismo),17/07/2017,6009454_448114.pdf
2017-07-17 11:21:47,LINHA SÃO DOMINGOS (JAMIR LESSE),,Mariano Moro,11,,21,04/07/2017,SAC,SIM,VERA LUCIA DALPUPO,SIM,NÃO,NILTON VENDRAME,FISCAL SANITÁRIO,SECRETARIA MUNICIPAL DE SAÚDE,NILTON VENDRAME - VIGIAGUA MUNICIPAL,17/07/2017,
2017-07-17 13:37:47,LINHA CAMPO ANTAS,,Três Arroios,11,,51,26/06/2017,SAC,SIM,VERA LUCIA DAL PUPO,SIM,SIM,VALDIR BONI,FISCAL SANITÁRIO,SECRETARIA MUNICIPAL DE SAUDE,VALDIR BONI FISCAL SANITÁRIO,17/07/2017,
2017-07-17 15:41:43,SOCIEDADE ABASTECEDORA DE AGUA COLINAS,,Colinas,16,,1240,04/07/2017,SAC,SIM,Edu Ricardo Beltrame,SIM,NÃO,Fabio Oscar Schardong,Supervisor do Setor se Sanidade Animal,Secretaria Municipal do Meio Ambiente,Fabio Oscar Schardong- Supervisor do Setor se Sanidade Animal,17/07/2017,6012354_448114.pdf
2017-07-17 15:46:30,SOCIEDADE ABASTECEDORA DE AGUA COLINAS,,Colinas,16,,1240,04/07/2017,SAC,SIM,Edu Ricardo Beltrame,SIM,NÃO,Fabio Oscar Schardong,Supervisor do Setor se Sanidade Animal,Secretaria Municipal do Meio Ambiente,Fabio Oscar Schardong - Supervisor do Setor se Sanidade Animal,17/07/2017,6012409_448114.pdf
2017-07-17 15:51:52,SOCIEDADE ABASTECIMENTO LINHA RONCADOR E BEIJA FLOR,,Colinas,16,,91,04/07/2017,SAC,SIM,Edu Ricardo Beltrame,SIM,NÃO,Fabio Oscar Schardong,Supervisor do Setor se Sanidade Animal,Secretaria Municipal do Meio Ambiente,Fabio Oscar Schardong- Supervisor do Setor se Sanidade Animal,17/07/2017,6012471_448114.pdf
2017-07-17 15:52:55,ASSOCIAÇÃO LINHA GIAQUINI,,Cruzaltense,11,,39,26/06/2017,SAC,SIM,JEAN CARLOS MERG,NÃO,SIM,VAGNER SANDRI,FISCAL AMBIENTA/SANITÁRIO/ URBANISMO,SECRETARIA MUNICIPAL DE SAUDE,Adriane Boniatti ( Coordenadora da Visa)Vagner Sandri ( Fiscal Ambiental/Sanitario/Urbanismo),17/07/2017,6012484_448114.pdf
2017-07-17 15:54:12,ASSOCIAÇÃO DE ABASTECIMENTO DE AGUA LINHA SANTO ANTONIO,,Colinas,16,,191,04/07/2017,SAC,SIM,Edu Ricardo Beltrame,SIM,NÃO,Fabio Oscar Schardong,Supervisor do Setor se Sanidade Animal,Secretaria Municipal do Meio Ambiente,Fabio Oscar Schardong -Supervisor do Setor se Sanidade Animal,17/07/2017,6012492_448114.pdf
2017-07-17 15:57:23,ASSOCIAÇÃO DE AGUA LINHA LEOPOLDINA,,Colinas,16,,100,04/07/2017,SAC,SIM,JULIANA INES KRAEMER,SIM,NÃO,Fabio Oscar Schardong,Supervisor do Setor se Sanidade Animal,Secretaria Municipal do Meio Ambiente,Fabio Oscar Schardong - Supervisor do Setor se Sanidade Animal,17/07/2017,6012526_448114.pdf
2017-07-17 15:59:55,SOCIEDADE DE ÁGUA LINHA ANO BOM ALTO,,Colinas,16,,174,04/07/2017,SAC,SIM,JULIANA INES KRAEMER,SIM,NÃO,Fabio Oscar Schardong,Supervisor do Setor se Sanidade Animal,Secretaria Municipal do Meio Ambiente,Fabio Oscar Schardong  - Supervisor do Setor se Sanidade Animal,17/07/2017,6012549_448114.pdf
2017-07-17 16:13:52 (2017-07-17 16:05:52),SAC VILA CASCATA,,Horizontina,14,,,14/07/2017,SAC,NÃO,,NÃO,SIM,ANDREIA RAQUEL DINIZ,FISCAL SANITARIO,VIGILÂNCIA SANITÁRIA DE HORIZONTINA,ANDREIA RAQUEL DINIZ - FISCAL SANITÁRIOEMILIA GUSMAN - FISCAL SANITÁRIO ,17/07/2017,6012601_448114.pdf
2017-07-17 16:25:09,ASSOCIAÇÃO LINHA LOPES,,Cruzaltense,11,,69,28/06/2017,SAC,SIM,JEAN CARLOS MERG,NÃO,SIM,VAGNER SANDRI,FISCAL AMBIENTA/SANITÁRIO/ URBANISMO,SECRETARIA MUNICIPAL DE SAUDE,Adriane Boniatti ( Coordenadora da Visa)Vagner Sandri ( Fiscal Ambiental/Sanitario/Urbanismo),17/07/2017,6012770_448114.pdf
2017-07-18 09:43:25,ESQUINA ELDORADO,,Horizontina,14,,278,12/07/2017,SAC,NÃO,,,,ANDREIA RAQUEL DINIZ,FISCAL SANITARIO,VIGILÂNCIA SANITÁRIA DE HORIZONTINA,Andréia Raquel Diniz - Fiscal VISAEmilia Gusman - Fiscal VISA ,17/07/2017,6015219_448114.pdf
2017-07-18 09:50:35,ESQUINA FIGUEIRA,,Horizontina,14,,25,12/07/2017,SAC,NÃO,,NÃO,,ANDREIA RAQUEL DINIZ,FISCAL SANITARIO,VIGILÂNCIA SANITÁRIA DE HORIZONTINA,Andréia Raquel Diniz - Fiscal VISAEmilia Gusman - Fiscal VISA ,17/07/2017,6015309_448114.pdf
2017-07-18 09:56:00,ASSOCIAÇÃO LINHA PRINCESA ISABEL,,Cruzaltense,11,,72,28/06/2017,SAC,SIM,JEAN CARLOS MERG,NÃO,SIM,VAGNER SANDRI,FISCAL AMBIENTA/SANITÁRIO/ URBANISMO,SECRETARIA MUNICIPAL DE SAUDE,Adriane Boniatti ( Coordenadora da Visa)Vagner Sandri ( Fiscal Ambiental/Sanitario/Urbanismo),18/07/2017,6015379_448114.pdf
2017-07-18 10:04:01,LAJEADO GUILHERME II,,Horizontina,14,,81,12/07/2017,SAC,NÃO,,NÃO,SIM,ANDREIA RAQUEL DINIZ,FISCAL SANITARIO,VIGILÂNCIA SANITÁRIA DE HORIZONTINA,Andréia Raquel Diniz - Fiscal VISAEmilia Gusman - Fiscal VISA ,17/07/2017,6015481_448114.pdf
2017-07-18 10:05:19,SAC COLINA VERDE,,Bagé,7,,500,27/06/2017,SAC,SIM,JOGE WÁGNER BRAGA,NÃO,NÃO,DANIEL AUGUSTO CORREA TEIXEIRA,AGENTE DE COMBATE A ENDEMIAS,SERETARIA MUNICIPAL DE SAÚDE E APOIO À PESOA COM DEFICIÊNCIA,DANIEL E CLÉBER VILMAR MORAIS,20/07/2017,6015496_448114.pdf
2017-07-18 10:25:31,SAC MARFRIG GLOBAL FOODS S.A,,Bagé,7,,1500,22/06/2017,SAC,SIM,CAMILLE BIRON,SIM,NÃO,DANIEL AUGUSTO CORREA TEIXEIRA,AGENTE DE COMBATE A ENDEMIAS,SERETARIA MUNICIPAL DE SAÚDE E APOIO À PESOA COM DEFICIÊNCIA,DANIEL E CLÉBER VILMAR MORAIS,18/07/2017,6015726_448114.pdf
2017-07-18 13:31:35,ASSOCIAÇÃO COMUNITÁRIA SÃO MIGUEL 2,,Independência,14,,35,11/07/2017,SAC,NÃO,,NÃO,NÃO,KLEBER JUNG,ENFERMEIRO/VIGILÂNCIA EM SAÚDE,SECRETARIA MUNICIPAL DE SAÚDE,KLEBER JUNG - ENFERMEIRO,27/07/2017,6017575_448114.pdf
2017-07-18 13:35:22,SAC,,Nonoai,11,,60,13/07/2017,SAC,SIM,Marines Nodari,SIM,SIM,ROSANIA DA SILVA,Fiscal Sanitário,Secretária Municipal de Saúde ( Prefeitura Municipal),ROSANIA DA SILVA- FISCAL SANITÁRIODANIELE PAIANO- AGENTE AMBIENTALJUSSARA RODRIGUES CHENTE- BIÓLOGA,18/07/2017,6017604_448114.docx
2017-07-18 14:01:56,LINHA SANTA CRUZ,,Três Arroios,11,,69,18/06/2017,SAC,SIM,VERA LUCIA DAL PUPO,SIM,SIM,VALDIR BONI,FISCAL SANITÁRIO,SECRETARIA MUNICIPAL DE SAUDE,VALDIR BONI FISCAL SANITÁRIO,18/07/2017,
2017-07-18 14:27:33 (2017-07-18 14:26:39),SAC RIO TOLDO,,Getúlio Vargas,11,,198,29/06/2017,SAC,NÃO,,NÃO,SIM,Jean Pierre Soccol,Coordenador Vigilancia Sanitária,Secretaria Municipal de Saúde,Jean P. Soccol - Coordenador VISATheobaldo J. Scherer - Fiscal SanitárioDilvo J. Glowacki - Vigilante Ambiental,10/07/2017,6018043_448114.pdf
2017-07-18 14:33:15,SAC LINHA 7,,Getúlio Vargas,11,,48,29/06/2017,SAC,NÃO,,NÃO,SIM,Jean Pierre Soccol,Coordenador Vigilancia Sanitária,Secretaria Municipal de Saúde,Jean P. Soccol - Coordenador VISATheobaldo J. Scherer - Fiscal SanitárioDilvo J. Glowacki - Vigilante Ambiental,10/07/2017,6018106_448114.pdf
2017-07-18 15:25:25,SAC,,Nonoai,11,,57,17/07/2017,SAC,SIM,Marines Nodari,SIM,SIM,ROSANIA DA SILVA,Fiscal Sanitário,Secretária Municipal de Saúde ( Prefeitura Municipal),ROSANIA DA SILVA- FISCAL SANITARIODANIELE PAIANO- AGENTE AMBIENTALJUSSARA RODRIGUES CHENTE- BIÓLOGA,18/07/2017,6018704_448114.docx
2017-07-18 15:33:20,SAC SANTA CASA,,Bagé,7,,500,26/06/2017,SAC,SIM,LETÍCIA OTERO BRUNI,SIM,NÃO,DANIEL AUGUSTO CORREA TEIXEIRA,AGENTE DE COMBATE A ENDEMIAS,SERETARIA MUNICIPAL DE SAÚDE E APOIO À PESOA COM DEFICIÊNCIA,DANIEL E CLÉBER VILMAR MORAIS,18/07/2017,6018789_448114.pdf
2017-07-18 16:22:53,lLINHA CERRO ALEGRE,,Três Arroios,11,,120,27/06/2017,SAC,SIM,VERA LUCIA DAL PUPO,SIM,SIM,VALDIR BONI,FISCAL SANITÁRIO,SECRETARIA MUNICIPAL DE SAUDE,VALDIR BONI FISCAL SANITÁRIO,18/07/2017,
2017-07-19 09:43:11,ASSOCIAÇÃO LINHA RIO LISO 1,,Cruzaltense,11,,57,04/07/2017,SAC,SIM,JEAN CARLOS MERG,NÃO,SIM,VAGNER SANDRI,FISCAL AMBIENTA/SANITÁRIO/ URBANISMO,SECRETARIA MUNICIPAL DE SAUDE,Adriane Boniatti ( Coordenadora da Visa)Vagner Sandri ( Fiscal Ambiental/Sanitario/Urbanismo),19/07/2017,6021269_448114.pdf
2017-07-19 14:29:38,SAC sede do município,,Novo Machado,14,,1053,19/07/2017,SAC,NÃO,,NÃO,SIM,Carlos Roberto Rex,Fiscal Sanitário,Novo Machado,Carlos Roberto Rex - Fiscal Sanitário,20/07/2017,6024074_448114.docx
2017-07-19 14:56:58,Sac Vila Seca,,Novo Machado,14,,30,19/07/2017,SAC,NÃO,,NÃO,SIM,Carlos Roberto Rex,Fiscal Sanitário,Novo Machado,Carlos Roberto Rex - Fiscal Sanitário,20/07/2017,6024332_448114.pdf
2017-07-19 16:56:43,SAA Barão do Rio Branco,,Passo do Sobrado,13,,330,30/06/2017,SAA,SIM,Angelica Beatriz Ammon,SIM,SIM,Lea Santos Ferreira,Médica Veterinária ,Prefeitura Municipal de Passo do Sobrado,Léa Santos Ferreira - Médica Veterinária Vigilância SanitáriaElira Pereira Dias -VIGIAGUA 13 CRS Angelica Beatriz Ammon - Agente de Vigilância em Saúde Fiscal,,6025437_448114.docx
2017-07-20 07:45:32,LINHA VACA MORTA IVETE,,Três Arroios,11,,48,21/06/2017,SAC,SIM,VERA LUCIA DAL PUPO,SIM,SIM,VALDIR BONI,FISCAL SANITÁRIO,SECRETARIA MUNICIPAL DE SAUDE,VALDIR BONI FISCAL SANITÁRIO,20/07/2017,
2017-07-20 08:00:32,LINHA LAJEADO DOS PORCOS,,Três Arroios,11,,21,27/06/2017,SAC,SIM,VERA LUCIA DAL PUPO,SIM,SIM,VALDIR BONI,FISCAL SANITÁRIO,SECRETARIA MUNICIPAL DE SAUDE,VALDIR BONI FISCAL SANITÁRIO,20/07/2017,
2017-07-20 08:05:21,LINHA COXILHA SECA,,Três Arroios,11,,252,28/06/2017,SAC,SIM,VERA LUCIA DAL PUPO,SIM,SIM,VALDIR BONI,FISCAL SANITÁRIO,SECRETARIA MUNICIPAL DE SAUDE,VALDIR BONI FISCAL ANITÁRIO,20/07/2017,
2017-07-20 08:10:48,LINHA ÉCCO,,Três Arroios,11,,24,25/06/2017,SAC,SIM,VERA LUCIA DAL PUPO,SIM,SIM,VALDIR BONI,FISCAL SANITÁRIO,SECRETARIA MUNICIPAL DE SAUDE,VALDIR BONI FISCAL SANITÁRIO,20/07/2017,
2017-07-20 08:17:45,LINHA SANTO ANTONIO,,Três Arroios,11,,84,21/06/2017,SAC,SIM,VERA LUCIA DAL PUPO,SIM,SIM,VALDIR BONI,FISCAL SANITÁRIO,SECRETARIA MUNICIPAL DE SAUDE,VALDIR BONI FISCAL SANITÁRIO,20/07/2017,
2017-07-20 08:22:41,LINHA ACAMPAMENTO 2,,Três Arroios,11,,21,30/06/2017,SAC,SIM,VERA LUCIA DAL PUPO,SIM,SIM,VALDIR BONI,FISCAL SANITÁRIO,SECRETARIA MUNICIPAL DE SAUDE,VALDIR BONI FISCAL SANITÁRIO,20/07/2017,
2017-07-20 08:27:13,LINHA 3 BURI,,Três Arroios,11,,36,22/06/2017,SAC,SIM,VERA LUCIA DAL PUPO,SIM,SIM,VALDIR BONI,FISCAL SANITÁRIO,SECRETARIA MUNICIPAL DE SAUDE,VALDIR BONI FISCAL SANITÁRIO,20/07/2017,
2017-07-20 08:35:07,LINHA  3,,Três Arroios,11,,36,26/06/2017,SAC,SIM,VERA LUCIA DAL PUPO,SIM,SIM,VALDIR BONI,FISCAL SANITÁRIO,SECRETARIA MUNICIPAL DE SAUDE,VALDIR BONI FISCAL SANITÁRIO,20/07/2017,
2017-07-20 09:42:39,SAC Barra Terencio,,Novo Machado,14,,34,19/07/2017,SAC,NÃO,,NÃO,SIM,Carlos Roberto Rex,Fiscal Sanitário,Novo Machado,Carlos Roberto Rex - Fiscal Sanitário,20/07/2017,6027155_448114.pdf
2017-07-20 10:01:12,SAC Vila Pratos,,Novo Machado,14,,997,19/07/2017,SAC,NÃO,,SIM,SIM,Carlos Roberto Rex,Fiscal Sanitário,Novo Machado,Carlos Roberto Rex - Fiscal Sanitário,20/07/2017,6027347_448114.pdf
2017-07-20 10:35:11,SAC KM 13,,Getúlio Vargas,11,,116,29/06/2017,SAC,NÃO,,NÃO,SIM,Jean Pierre Soccol,Coordenador Vigilancia Sanitária,Secretaria Municipal de Saúde,Jean P. Socccol - Coordenador VISATheobaldo J. Scherer - Fiscal SanitárioDilvo J. Glowacki - Vigilante Ambiental,12/07/2017,6027682_448114.pdf
2017-07-20 14:40:46,São Miguel,,Nova Candelária,14,,72,20/07/2017,SAC,NÃO,,SIM,NÃO,Luana Vanessa Schwarzer,Vigilância Sanitária,Prefeitura Municipal de Nova Candelária,Luana Vanessa Schwarzer = vigilância sanitária,21/07/2017,
2017-07-20 14:48:10,SAC,,Nonoai,11,,30,20/07/2017,SAC,SIM,Marines Nodari,SIM,SIM,ROSANIA DA SILVA,Fiscal Sanitário,Secretária Municipal de Saúde ( Prefeitura Municipal),ROSANIA DA SILVA- FISCAL SANITÁRIODANIELE PAIANO- AGENTE AMBIENTALJUSSARA RODRIGUES CHENTE- BIOLOGA,20/07/2017,6029652_448114.docx
2017-07-21 15:21:54,SAC LINHA PEDREIRA,,Paulo Bento,11,,35,14/07/2017,SAC,SIM,Álvaro Luís Malvesti,SIM,SIM,RENATO IVAN GROMANN,VIGILANTE SANITARIO E AMBIENTAL EM SAUDE,SECRETARIA MUNICIPAL DE SAUDE,RENATO IVAN GROMANN - VIGILANTE SANITARIO E AMBIENTAL EM SAUDECAREN RENATO CRISTANI GOLLO - COORDENADORA VISA,21/07/2017,6034866_448114.pdf
2017-07-21 15:27:45 (2017-07-21 15:15:45),SAC LINHA PINHAL,,Paulo Bento,11,,110,14/07/2017,SAC,SIM,Álvaro Luís Malvesti,SIM,NÃO,RENATO IVAN GROMANN,VIGILANTE SANITARIO E AMBIENTAL EM SAUDE,SECRETARIA MUNICIPAL DE SAUDE,RENATO IVAN GROMANN - VIGILANTE SANITARIO E AMBIENTAL EM SAUDECAREN RENATA CRISTANI GOLLO - COORDENADOR DA VISA,21/07/2017,6034820_448114.pdf
2017-07-24 08:56:21,ASSOCIAÇÃO LINHA SANTA CRUZ,,Cruzaltense,11,,48,22/06/2016,SAC,SIM,JEAN CARLOS MERG,NÃO,SIM,VAGNER SANDRI,FISCAL AMBIENTA/SANITÁRIO/ URBANISMO,SECRETARIA MUNICIPAL DE SAUDE,Adriane Boniatti ( Coordenadora da Visa)Vagner Sandri ( Fiscal Ambiental/Sanitario/Urbanismo),24/07/2017,6037910_448114.pdf
2017-07-25 08:23:46,ASSOCIAÇÃO LINHA COXILHA SECA,,Cruzaltense,11,,10,26/06/2017,SAC,SIM,JEAN CARLOS MERG,NÃO,SIM,VAGNER SANDRI,FISCAL AMBIENTA/SANITÁRIO/ URBANISMO,SECRETARIA MUNICIPAL DE SAUDE,Adriane Boniatti ( Coordenadora da Visa)Vagner Sandri ( Fiscal Ambiental/Sanitario/Urbanismo),25/07/2017,6043492_448114.pdf
2017-07-25 08:32:35,ASSOCIAÇÃO LINHA DEZ,,Cruzaltense,11,,63,22/06/2017,SAC,SIM,JEAN CARLOS MERG,NÃO,SIM,VAGNER SANDRI,FISCAL AMBIENTA/SANITÁRIO/ URBANISMO,SECRETARIA MUNICIPAL DE SAUDE,Adriane Boniatti ( Coordenadora da Visa)Vagner Sandri ( Fiscal Ambiental/Sanitario/Urbanismo),25/07/2017,6043568_448114.pdf
2017-07-25 08:44:06,ASSOCIAÇÃO LINHA TREZE,,Cruzaltense,11,,60,28/06/2017,SAC,SIM,JEAN CARLOS MERG,NÃO,SIM,VAGNER SANDRI,FISCAL AMBIENTA/SANITÁRIO/ URBANISMO,SECRETARIA MUNICIPAL DE SAUDE,Adriane Boniatti ( Coordenadora da Visa)Vagner Sandri ( Fiscal Ambiental/Sanitario/Urbanismo),25/07/2017,6043673_448114.pdf
2017-07-25 08:53:27,ASSOCIAÇÃO LINHA NOSSA SENHORA DE LURDES,,Cruzaltense,11,,132,22/06/2017,SAC,SIM,JEAN CARLOS MERG,NÃO,SIM,VAGNER SANDRI,FISCAL AMBIENTA/SANITÁRIO/ URBANISMO,SECRETARIA MUNICIPAL DE SAUDE,Adriane Boniatti ( Coordenadora da Visa)Vagner Sandri ( Fiscal Ambiental/Sanitario/Urbanismo),25/07/2017,6043777_448114.pdf
2017-07-25 09:42:13,ASSOCIAÇÃO COMUNITÁRIA SÃO VALENTIM/PEDRGULHO,,Independência,14,,45,21/07/2017,SAC,NÃO,,NÃO,NÃO,KLEBER JUNG,ENFERMEIRO/VIGILÂNCIA EM SAÚDE,SECRETARIA MUNICIPAL DE SAÚDE,KLEBER JUNG - ENFERMEIRO,27/07/2017,6044313_448114.pdf
2017-07-25 09:47:21,ASSOCIAÇÃO COMUNITÁRIA CONQUISTADORA,,Independência,14,,21,21/07/2017,SAC,NÃO,,NÃO,NÃO,KLEBER JUNG,ENFERMEIRO/VIGILÂNCIA EM SAÚDE,SECRETARIA MUNICIPAL DE SAÚDE,KLEBER JUNG - ENFERMEIRO,27/07/2017,6044368_448114.pdf
2017-07-25 09:52:53,ASSOCIAÇÃO COMUNITÁRIA ESQUINA SUTIL,,Independência,14,,33,21/07/2017,SAC,NÃO,,NÃO,NÃO,KLEBER JUNG,ENFERMEIRO/VIGILÂNCIA EM SAÚDE,SECRETARIA MUNICIPAL DE SAÚDE,KLEBER JUNG - ENFERMEIRO,27/07/2017,6044433_448114.pdf
2017-07-25 13:23:40,SAA- Companhia Riograndense de Saneamento  -CORSAN,,Júlio de Castilhos,4,,17757,29/06/2017,SAA,SIM,Karine Kochann Rhoden Mayer,SIM,NÃO,Juliano Binotto Pereira,Agente de Vigilância Sanitária,Secretaria Municipal de Saúde de Júlio de Castilhos,Juliano Binotto Pereira - VISA MunicipioDirseu Emilio Castiglioni – VISA – 4ª CRS - Santa Maria responsável regional,31/07/2017,
2017-07-25 14:12:04,ASSOCIAÇÃO LINHA NOVE,,Cruzaltense,11,,39,22/06/2017,SAC,SIM,JEAN CARLOS MERG,NÃO,SIM,VAGNER SANDRI,FISCAL AMBIENTA/SANITÁRIO/ URBANISMO,SECRETARIA MUNICIPAL DE SAUDE,Adriane Boniatti ( Coordenadora da Visa)Vagner Sandri ( Fiscal Ambiental/Sanitario/Urbanismo),25/07/2017,6047181_448114.pdf
2017-07-26 11:58:56,ASSOCIAÇÃO ÁGUA POTAVEL ACRE ,,Cândido Godói,14,,94,13/07/2017,SAC,NÃO,,NÃO,,VALDIR SACKS,FISCAL SANITARIO,VIGILANCIA SANITÁRIA - SAUDE,VALDIR SACKS FISCAL SANITÁRIOJOSÉ DE SOUZA MATOS AGENTE SANITARISTA,13/07/2017,6055105_448114.pdf
2017-07-26 12:35:52,ASSOCIAÇÃO ÁGUA POTAVEL ACRE SUL,,Cândido Godói,14,,82,13/07/2017,SAC,NÃO,,NÃO,,VALDIR SACKS,FISCAL SANITARIO,VIGILANCIA SANITÁRIA - SECRETARIA MUNICIPAL DEA SAUDE ,VALDIR SACKS FISCAL SANITÁRIO JOSÉ DE SOUZA MATOS  AGENTE SANITARISTA ,13/07/2017,6055523_448114.pdf
2017-07-26 13:24:56,ASSOCIAÇÃO LINHA SANTA CATARINA,,Cruzaltense,11,,90,21/06/2017,SAC,SIM,JEAN CARLOS MERG,NÃO,SIM,VAGNER SANDRI,FISCAL AMBIENTA/SANITÁRIO/ URBANISMO,SECRETARIA MUNICIPAL DE SAUDE,Adriane Boniatti ( Coordenadora da Visa)Vagner Sandri ( Fiscal Ambiental/Sanitario/Urbanismo),26/07/2017,6055890_448114.pdf
2017-07-26 13:42:39,ASSOCIAÇÃO LINHA SÃO ROQUE,,Cruzaltense,11,,156,22/06/2017,SAC,SIM,JEAN CARLOS MERG,NÃO,SIM,VAGNER SANDRI,FISCAL AMBIENTA/SANITÁRIO/ URBANISMO,SECRETARIA MUNICIPAL DE SAUDE,Adriane Boniatti ( Coordenadora da Visa)Vagner Sandri ( Fiscal Ambiental/Sanitário/Urbanismo),26/07/2017,6056099_448114.pdf
2017-07-26 13:54:22,ASSOCIAÇÃO ÁGUA POTAVEL ABRANTES,,Cândido Godói,14,,137,26/07/2017,SAC,NÃO,,,,VALDIR SACKS,FISCAL SANITARIO,VIGILANCIA SANITÁRIA - SECRETARIA MUNICIPAL DEA SAUDE,VALDIR SACKS FISCAL SANITÁRIOJOSÉ DE SOUZA MATOS AGENTE SANITARISTA,26/07/2017,6056270_448114.pdf
2017-07-26 14:13:46,ASSOCIAÇÃO LINHA RIO LISO 2,,Cruzaltense,11,,51,04/07/2017,SAC,SIM,JEAN CARLOS MERG,NÃO,SIM,VAGNER SANDRI,FISCAL AMBIENTA/SANITÁRIO/ URBANISMO,SECRETARIA MUNICIPAL DE SAUDE,Adriane Boniatti (Coordenadora da Visa)Vagner Sandri (Fiscal Ambiental/Sanitário/Urbanismo),26/07/2017,6056567_448114.pdf
2017-07-26 14:19:30,ASSOCIAÇÃO ÁGUA POTAVEL NATAL,,Cândido Godói,14,,101,14/07/2017,SAC,NÃO,,NÃO,NÃO,VALDIR SACKS,FISCAL SANITARIO,VIGILANCIA SANITÁRIA - SECRETARIA MUNICIPAL DEA SAUDE,VALDIR SACKS FISCAL SANITÁRIOJOSE DE SOUZA MATOS AGENTE SANITARISTA ,14/07/2017,6056653_448114.pdf
2017-07-26 14:56:44,ASSOCIAÇÃO ÁGUA POTAVEL PARANAGUA,,Cândido Godói,14,,94,18/07/2017,SAC,NÃO,,NÃO,,VALDIR SACKS,FISCAL SANITARIO,VIGILANCIA SANITÁRIA - SECRETARIA MUNICIPAL DEA SAUDE,Valdir Sacks Fiscal SanitárioJOSÉ SOUZA MATOS AGENTE SANITÁRIO,18/07/2017,6057141_448114.pdf
2017-07-26 15:24:22,POÇO LINHA DONA ALICE,,Mato Queimado,12,,1789,26/07/2017,SAC,NÃO,,NÃO,SIM,STEFANIE CORNEJO PONTELLI,FARMACEUTICA/FISCAL SANITARIA,SECRETARIA MUNICIPAL DE SAÚDE DE MATO QUEIMADO,Marcieli Schlotefeldt Klein: fiscal sanitária. Stefanie Cornejo Pontelli: fiscal sanitária. Lucia Clarisse Marx Welter: fiscal sanitária.,,6057524_448114.pdf
2017-07-26 15:27:17,POÇO RONDINHA,,Mato Queimado,12,,1789,26/07/2017,SAC,NÃO,,NÃO,SIM,STEFANIE CORNEJO PONTELLI,FARMACEUTICA/FISCAL SANITARIA,SECRETARIA MUNICIPAL DE SAÚDE DE MATO QUEIMADO,Marcieli Schlotefeldt Klein: fiscal sanitária. Stefanie Cornejo Pontelli: fiscal sanitária. Lucia Clarisse Marx Welter: fiscal sanitária.,,6057573_448114.pdf
2017-07-26 16:22:04,SAC- COMUNIDADE VILA UNIÃO,,Entre Rios do Sul,11,,97,19/07/2017,SAC,SIM,ALVARO LUIZ MALVESTI,SIM,SIM,ISAIAS CASSIANO SECCO,FISCAL SANITÁRIO,SECRETARIA MUNICIPAL DE SAÚDE,ISAIAS CASSIANO SECCO, FISCAL SANITÁRIO,26/07/2017,6058368_448114.pdf
2017-07-26 16:30:57,SAC- COMUNIDADE DE VOLTA VERDE - INTERIOR,,Entre Rios do Sul,11,,46,10/07/2017,SAC,SIM,ALVARO LUIZ MALVESTI,SIM,SIM,ISAIAS CASSIANO SECCO,FISCAL SANITÁRIO,SECRETARIA MUNICIPAL DE SAÚDE,ISAIAS CASSIANO SECCO, FISCAL SANITÁRIO,26/07/2017,6058501_448114.pdf
2017-07-26 16:34:08,SAC- LINHA BARCA - INTERIOR,,Entre Rios do Sul,11,,40,18/07/2017,SAC,SIM,ALVARO LUIZ MALVESTI,SIM,SIM,ISAIAS CASSIANO SECCO,FISCAL SANITÁRIO,SECRETARIA MUNICIPAL DE SAÚDE,ISAIAS CASSIANO SECCO, FISCAL SANITÁRIO,26/07/2017,6058550_448114.pdf
2017-07-26 16:37:03,SAC- LINHA GABOARDI - INTERIOR,,Entre Rios do Sul,11,,71,11/07/2017,SAC,SIM,ALVARO LUIZ MALVESTI,SIM,SIM,ISAIAS CASSIANO SECCO,FISCAL SANITÁRIO,SECRETARIA MUNICIPAL DE SAÚDE,ISAIAS CASSIANO SECCO, FISCAL SANITÁRIO,26/07/2017,6058600_448114.pdf
2017-07-26 16:42:29,SAC- LINHA PANIS - INTERIOR,,Entre Rios do Sul,11,,65,13/07/2017,SAC,SIM,ALVARO LUIZ MALVESTI,SIM,SIM,ISAIAS CASSIANO SECCO,FISCAL SANITÁRIO,SECRETARIA MUNICIPAL DE SAÚDE,ISAIAS CASSIANO SECCO, FISCAL SANITÁRIO,26/07/2017,6058686_448114.pdf
2017-07-26 16:44:37,SAC- LINHA SANTA RITA - INTERIOR,,Entre Rios do Sul,11,,23,14/07/2017,SAC,SIM,ALVARO LUIZ MALVESTI,SIM,SIM,ISAIAS CASSIANO SECCO,FISCAL SANITÁRIO,SECRETARIA MUNICIPAL DE SAÚDE,ISAIAS CASSIANO SECCO, FISCAL SANITÁRIO,26/07/2017,6058719_448114.pdf
2017-07-26 16:51:17,SAC- COMUNIDADE DE ALTO ALEGRE-INTERIOR,,Entre Rios do Sul,11,,74,18/07/2017,SAC,SIM,ALVARO LUIZ MALVESTI,SIM,SIM,ISAIAS CASSIANO SECCO,FISCAL SANITÁRIO,SECRETARIA MUNICIPAL DE SAÚDE,ISAIAS CASSIANO SECCO, FISCAL SANITÁRIO,26/07/2017,6058811_448114.pdf
2017-07-26 16:53:08,SAC- LINHA LIRA - INTERIOR,,Entre Rios do Sul,11,,29,12/07/2017,SAC,SIM,ALVARO LUIZ MALVESTI,SIM,SIM,ISAIAS CASSIANO SECCO,FISCAL SANITÁRIO,SECRETARIA MUNICIPAL DE SAÚDE,ISAIAS CASSIANO SECCO, FISCAL SANITÁRIO,26/07/2017,6058843_448114.pdf
2017-07-27 10:39:04,ASSOCIAÇÃO ÁGUA POTAVEL SÃO MIGUEL ,,Cândido Godói,14,,91,19/07/2017,SAC,NÃO,,SIM,NÃO,VALDIR SACKS,FISCAL SANITARIO,VIGILANCIA SANITÁRIA - SECRETARIA MUNICIPAL DEA SAUDE,VALDIR SACKS FISCAL SANITÁRIOJOSÉ DE SOUZA MATOS AGENTE SANITÁRIO,19/07/2017,6062347_448114.pdf
2017-07-27 11:05:29,ASSOCIAÇÃO ÁGUA POTAVEL SÃO PEDRO,,Cândido Godói,14,,217,21/07/2017,SAC,NÃO,,SIM,NÃO,VALDIR SACKS,FISCAL SANITARIO,VIGILANCIA SANITÁRIA - SECRETARIA MUNICIPAL DEA SAUDE,VALDIR SACKS FISCAL SANITÁRIOJOSÉ DE SOUZA MATOS AGENTE SANITÁRIO,21/07/2017,6062729_448114.pdf
2017-07-28 09:05:01,ASSOCIAÇÃO ÁGUA POTAVEL BOA VISTA,,Cândido Godói,14,,121,24/07/2017,SAC,NÃO,,NÃO,,VALDIR SACKS,FISCAL SANITARIO,VIGILANCIA SANITÁRIA - SECRETARIA MUNICIPAL DEA SAUDE,VALDIR SACKS FISCAL SANITÁRIO JOSÉ DE SOUZA MATOS AGENTE SANITÁRIO,24/07/2017,6068702_448114.pdf
2017-07-28 09:23:56,ASSOCIAÇÃO ÁGUA POTAVEL PIRATINI,,Cândido Godói,14,,181,29/07/2017,SAC,NÃO,,NÃO,,VALDIR SACKS,FISCAL SANITARIO,VIGILANCIA SANITÁRIA - SECRETARIA MUNICIPAL DEA SAUDE,VALDIR SACKS FISCAL SANITÁRIOJOSÉ DE SOUZA MATOS AGENTE SANITÁRIO,29/07/2017,6068972_448114.pdf
2017-07-28 09:44:15,SAC,,Nonoai,11,,69,28/07/2017,SAC,SIM,Marines Nodari,SIM,SIM,ROSANIA DA SILVA,Fiscal Sanitário,Secretária Municipal de Saúde ( Prefeitura Municipal),ROSANIA DA SILVA- FISCAL SANITARIODANIELE PAIANO- AGENTE AMBIENTALJUSSARA RODRIGUES CHENTE- BIÓLOGA,28/07/2017,6069285_448114.docx
2017-07-28 09:47:05,SAC,,Nonoai,11,,63,26/07/2017,SAC,SIM,Marines Nodari,SIM,SIM,ROSANIA DA SILVA,Fiscal Sanitário,Secretária Municipal de Saúde ( Prefeitura Municipal),ROSANIA DA SILVA- FISCAL SANITÁRIODANIELE PAIANO- AGENTE AMBIENTALJUSSARA RODRIGUES CHENTE- BIÓLOGA,28/07/2017,6069328_448114.docx
2017-07-28 10:13:45,ASSOCIAÇÃO ÁGUA POTAVEL SÃO BONIFACIO,,Cândido Godói,14,,127,28/07/2017,SAC,NÃO,,SIM,NÃO,VALDIR SACKS,FISCAL SANITARIO,VIGILANCIA SANITÁRIA - SECRETARIA MUNICIPAL DEA SAUDE,VALDIR SACKS FISCAL SANITÁRIO JOSÉ DE SOUZA MATOS AGENTE SANITÁRIO ,28/07/2017,6069742_448114.pdf
2017-07-28 10:43:03,ASSOCIAÇÃO ÁGUA POTAVEL SÃO JOÃO,,Cândido Godói,14,,160,18/07/2017,SAC,NÃO,,NÃO,SIM,VALDIR SACKS,FISCAL SANITARIO,VIGILANCIA SANITÁRIA - SECRETARIA MUNICIPAL DEA SAUDE,VALDIR SACKS FISCAL SANITÁRIO JOSÉ DE SOUZA MATOS FISCAL SANITÁRIO,18/07/2017,6070205_448114.pdf
2017-07-28 11:04:59,ASSOCIAÇÃO ÁGUA POTAVEL LASSALE ,,Cândido Godói,14,,106,24/07/2017,SAC,NÃO,,NÃO,,VALDIR SACKS,FISCAL SANITARIO,VIGILANCIA SANITÁRIA - SECRETARIA MUNICIPAL DEA SAUDE,VALDIR SACKS FISCAL SANITÁRIOJOSÉ DE SOUZA MATOS AGENTE SANITÁRIO,24/07/2017,6070566_448114.pdf
2017-07-28 13:12:44,RESSACA DO BURICÁ,,Alegria,14,,53,06/07/2017,SAC,SIM,MARINES NODARI,SIM,SIM,SHEILA CHRISTIANE MULLER,FISCAL SANITÁRIA, AMBIENTAL, TRIBUTÁRIO E DE OBRAS,SECRETARIA MUNICIPAL DE SAÚDE,SHEILA CHRISTIANE MULLER,28/07/2017,6072068_448114.docx
2017-07-28 15:35:57,RINCÃO VERDUM,,Alegria,14,,,07/07/2017,SAC,SIM,MARINES NODARI,SIM,NÃO,SHEILA CHRISTIANE MULLER,FISCAL SANITÁRIA, AMBIENTAL, TRIBUTÁRIO E DE OBRAS,SECRETARIA MUNICIPAL DE SAÚDE,SHEILA CHRISTIANE MULLER,28/07/2017,6073951_448114.docx
2017-07-28 16:15:14,CORSAN - PEDRAS ALTAS - PDA/05,,Pedras Altas,3,,1045,14/12/2016,SAA,SIM,Mauricio Oliveira de Sousa,SIM,NÃO,LEANDRO BANDEIRA DE BANDEIRA,AGENTE FISCAL SANITÁRIO,SECRETARIA MUNICIPAL DE SAÚDE DE PEDRAS ALTAS,LEANDRO BANDEIRA DE BANDEIRA - AGENTE FISCAL SANITÁRIO,16/01/2017,6074581_448114.pdf
2017-07-31 09:41:09,ASSOCIAÇÃO ÁGUA POTAVEL LOS LOUROS NORTE,,Cândido Godói,14,,52,14/07/2017,SAC,NÃO,,,,VALDIR SACKS,FISCAL SANITARIO,VIGILANCIA SANITÁRIA - SECRETARIA MUNICIPAL DEA SAUDE,VALDIR SACKS FISCAL SANITÁRIO JOSE DE SOUZA MATOS AGENTE SANITÁRIO,14/07/2017,6081284_448114.pdf
2017-07-31 10:48:00,ASSOCIAÇÃO ÁGUA POTAVEL LOS LOUROS ,,Cândido Godói,14,,157,31/07/2017,SAC,NÃO,,NÃO,,VALDIR SACKS,FISCAL SANITARIO,VIGILANCIA SANITÁRIA - SECRETARIA MUNICIPAL DEA SAUDE,VALDIR SACKS FISCAL SANITÁRIOJOSÉ DE SOUZA MATOS AGENTE SANITÁRIO,31/07/2017,6082154_448114.pdf
2017-07-31 14:07:44,SAC LINHA SÃO BENEDITO,,Paulo Bento,11,,35,14/07/2017,SAC,SIM,Álvaro Luís Malvesti,SIM,SIM,RENATO IVAN GROMANN,VIGILANTE SANITARIO E AMBIENTAL EM SAUDE,SECRETARIA MUNICIPAL DE SAUDE,RENATO IVAN GROMANN - VIGILANTE SANITÁRIO E AMBIENTALCAREN C. GOLLO - COORDENADORA VISA,28/07/2017,6084601_448114.pdf
2017-07-31 14:10:18,SAC LINHA QUATRO,,Paulo Bento,11,,63,14/07/2017,SAC,SIM,Álvaro Luís Malvesti,SIM,NÃO,RENATO IVAN GROMANN,VIGILANTE SANITARIO E AMBIENTAL EM SAUDE,SECRETARIA MUNICIPAL DE SAUDE,RENATO IVAN GROMANN - VIGILANTE SANITÁRIO E AMBIENTALCAREN C. GOLLO - COORDENADORA VISA,28/07/2017,6084633_448114.pdf
2017-07-31 14:12:40,SAC MARIA LINHA BARRA DO CRAVO,,Paulo Bento,11,,31,14/07/2017,SAC,SIM,Álvaro Luís Malvesti,SIM,NÃO,RENATO IVAN GROMANN,VIGILANTE SANITARIO E AMBIENTAL EM SAUDE,SECRETARIA MUNICIPAL DE SAUDE,RENATO IVAN GROMANN - VIGILANTE SANITÁRIO E AMBIENTALCAREN C. GOLLO - COORDENADORA VISA,28/07/2017,6084672_448114.pdf
2017-07-31 14:15:05,SAC LINHA SCANAGATTA,,Paulo Bento,11,,91,14/07/2017,SAC,SIM,Álvaro Luís Malvesti,SIM,SIM,RENATO IVAN GROMANN,VIGILANTE SANITARIO E AMBIENTAL EM SAUDE,SECRETARIA MUNICIPAL DE SAUDE,RENATO IVAN GROMANN - VIGILANTE SANITÁRIO E AMBIENTALCAREN C. GOLLO - COORDENADORA VISA,28/07/2017,6084707_448114.pdf
2017-07-31 15:12:16,ASSOCIAÇÃO ÁGUA POTAVEL SEÇÃO A ALTA ,,Cândido Godói,14,,79,24/07/2017,SAC,NÃO,,NÃO,,VALDIR SACKS,FISCAL SANITARIO,VIGILANCIA SANITÁRIA - SECRETARIA MUNICIPAL DEA SAUDE,VALDIR SACKS FISCAL SANITÁRIO JOSÉ DE SOUZA MATOS AGENTE SANITÁRIO,24/07/2017,6085553_448114.pdf
2017-07-31 15:47:04,ASSOCIAÇÃO ÁGUA POTAVEL DOZE NORTE ,,Cândido Godói,14,,157,14/07/2017,SAC,NÃO,,SIM,NÃO,VALDIR SACKS,FISCAL SANITARIO,VIGILANCIA SANITÁRIA - SECRETARIA MUNICIPAL DEA SAUDE,VALDIR SACKS FISCAL SANITÁRIOJOSÉ DE SOUZA MATOS AGENTE SANITÁRIO,14/07/2017,6086088_448114.pdf
2017-07-31 16:01:32,ASSOCIAÇÃO ÁGUA POTAVEL PEDERNEIRA,,Cândido Godói,14,,151,27/07/2017,SAC,NÃO,,NÃO,,VALDIR SACKS,FISCAL SANITARIO,VIGILANCIA SANITÁRIA - SECRETARIA MUNICIPAL DEA SAUDE,VALDIR SACKS FISACL SANITÁRIOJOSÉ DE SOUZA MATOS AGENTE SANITÁRIO,27/07/2017,6086318_448114.pdf
2017-07-31 16:16:43,ASSOCIAÇÃO ÁGUA POTAVEL SEÇÃO C BAIXA ,,Cândido Godói,14,,191,11/07/2017,SAC,NÃO,,NÃO,,VALDIR SACKS,FISCAL SANITARIO,VIGILANCIA SANITÁRIA - SECRETARIA MUNICIPAL DEA SAUDE,VALDIR SACKS FISCAL SANITARIOJOSÉ DE SOUZA MATOS AGENTE SANITARIO,11/07/2017,6086586_448114.pdf
2017-07-31 16:39:11,ASSOCIAÇÃO ÁGUA POTAVEL SEÇÃO C ALTA,,Cândido Godói,14,,79,11/07/2017,SAC,NÃO,,NÃO,,VALDIR SACKS,FISCAL SANITARIO,VIGILANCIA SANITÁRIA - SECRETARIA MUNICIPAL DEA SAUDE,VALDIR SACKS FISCAL SANITÁRIO JOSÉ DE SOUZA MATOS AGENTE SANITÁRIO ,11/07/2017,6086959_448114.pdf
2017-08-01 14:48:15,LINHA DOS COCCOS 02,,Nova Palma,4,,17,05/02/2016,SAC,NÃO,,SIM,SIM,LEONIRA CORTEZ MAZZARDO,FISCAL SANITARIO - VISA E VIGIAGUA/SMSAS,SECRETARIA MUNICIPAL DE SAÚDE E ASSISTÊNCIA SOCIAL,LEONIRA CORTEZ MAZZARDO - FISCAL SANITÁRIO 0404,04/04/2016,6093163_448114.pdf
2017-08-01 15:03:06,RINCÃO SANTO ANTONIO,,Nova Palma,4,,40,12/02/2016,SAC,NÃO,,SIM,SIM,LEONIRA CORTEZ MAZZARDO,FISCAL SANITARIO - VISA E VIGIAGUA/SMSAS,SECRETARIA MUNICIPAL DE SAÚDE E ASSISTÊNCIA SOCIAL,LEONIRA CORTEZ MAZZARDO - FISCAL SANITÁRIO,11/05/2016,6093358_448114.pdf
2017-08-01 15:10:24,LINHA GRAMADO,,Nova Palma,4,,70,18/02/2017,SAC,NÃO,,SIM,SIM,LEONIRA CORTEZ MAZZARDO,FISCAL SANITARIO - VISA E VIGIAGUA/SMSAS,SECRETARIA MUNICIPAL DE SAÚDE E ASSISTÊNCIA SOCIAL,LEONIRA CORTEZ MAZZARDO - FISCAL SANITÁRIO,02/05/2016,6093460_448114.pdf
2017-08-01 15:17:59,COMÉRCIO,,Nova Palma,4,,67,22/02/2016,SAC,NÃO,,,SIM,LEONIRA CORTEZ MAZZARDO,FISCAL SANITARIO - VISA E VIGIAGUA/SMSAS,SECRETARIA MUNICIPAL DE SAÚDE E ASSISTÊNCIA SOCIAL,LEONIRA CORTEZ MAZZARDO - FISCAL SANITARIO,04/03/2016,6093546_448114.pdf
2017-08-01 15:19:23,SAA,,Cacequi,4,,,27/06/2017,SAA,SIM,,SIM,SIM,Ariane L S Brum,Bióloga,SMS,Ariane L S Brum - BiólogaDirseu Castiglioni - Sanitarista VISA,02/08/2017,6093561_448114.pdf
2017-08-02 10:33:10,SAC TIGRE IV,,Severiano de Almeida,11,,48,22/06/2017,SAC,NÃO,,NÃO,,Alan Junior Solivo,Fiscal Sanitário,Secretaria Municipal de Saúde,ALAN JUNIOR SOLIVOLUCAS EDUARDO RIBEIRO,27/07/2017,6097699_448114.pdf
2017-08-02 15:55:29,ASSOCIAÇÃO ÁGUA POTAVEL SILVA JARDIM BAIXA,,Cândido Godói,14,,75,13/07/2017,SAC,NÃO,,SIM,NÃO,VALDIR SACKS,FISCAL SANITARIO,VIGILANCIA SANITÁRIA - SECRETARIA MUNICIPAL DEA SAUDE,VALDIR SACKS FISCAL SANITÁRIOJOSÉ DE SOUZA MATOS AGENTE SANITÁRIO,13/07/2017,6100948_448114.pdf
2017-08-02 16:01:22,ASSOCIAÇÃO ÁGUA POTAVEL CASCATA,,Cândido Godói,14,,136,03/08/2017,SAC,NÃO,,SIM,NÃO,VALDIR SACKS,FISCAL SANITARIO,VIGILANCIA SANITÁRIA - SECRETARIA MUNICIPAL DEA SAUDE,VALDIR SACKS FISCAL SANITÁRIOJOSÉ DE SOUZA MATOS AGENTE SANITÁRIO,03/08/2017,6101015_448114.pdf
2017-08-02 16:06:29,ASSOCIAÇÃO ÁGUA POTAVEL TREZE DE MAIO,,Cândido Godói,14,,88,28/07/2017,SAC,NÃO,,NÃO,,VALDIR SACKS,FISCAL SANITARIO,VIGILANCIA SANITÁRIA - SECRETARIA MUNICIPAL DEA SAUDE,VALDIR SACKS FISCAL SANITÁRIOJOSÉ DE SOUZA MATOS AGENTE SANITÁRIO,28/07/2017,6101080_448114.pdf
2017-08-03 08:12:27,CAMNPAL - RINCÃO DOS PADILHAS,,Nova Palma,4,,0,22/02/2016,SAC,NÃO,,SIM,SIM,LEONIRA CORTEZ MAZZARDO,FISCAL SANITARIO - VISA E VIGIAGUA/SMSAS,SECRETARIA MUNICIPAL DE SAÚDE E ASSISTÊNCIA SOCIAL,LEONIRA CORTEZ MAZZARDO - FISCAL SANITÁRIO,07/03/2017,6103036_448114.pdf
2017-08-03 08:22:59,RINCÃO DO BUGRE,,Nova Palma,4,,73,25/02/2016,SAC,NÃO,,NÃO,SIM,LEONIRA CORTEZ MAZZARDO,FISCAL SANITARIO - VISA E VIGIAGUA/SMSAS,SECRETARIA MUNICIPAL DE SAÚDE E ASSISTÊNCIA SOCIAL,LEONIRA CORTEZ MAZZARDO - FISCAL SANITÁRIO ,05/01/2017,6103131_448114.pdf
2017-08-03 08:30:11,GRAMADO,,Nova Palma,4,,103,25/06/2016,SAC,NÃO,,SIM,SIM,LEONIRA CORTEZ MAZZARDO,FISCAL SANITARIO - VISA E VIGIAGUA/SMSAS,SECRETARIA MUNICIPAL DE SAÚDE E ASSISTÊNCIA SOCIAL,LEONIRA CORTEZ MAZZARDO - FISCAL SANITÁRIO,02/05/2016,6103200_448114.pdf
2017-08-03 08:33:58,LINHA STEFANELLO,,Nova Palma,4,,40,25/06/2016,SAC,NÃO,,NÃO,SIM,LEONIRA CORTEZ MAZZARDO,FISCAL SANITARIO - VISA E VIGIAGUA/SMSAS,SECRETARIA MUNICIPAL DE SAÚDE E ASSISTÊNCIA SOCIAL,LEONIRA CORTEZ MAZZARDO - FISCAL SANITÁRIO,02/05/2017,6103234_448114.pdf
2017-08-03 08:39:50,SERC - NOVA PALMA,,Nova Palma,4,,03,24/08/2016,SAC,NÃO,,SIM,SIM,LEONIRA CORTEZ MAZZARDO,FISCAL SANITARIO - VISA E VIGIAGUA/SMSAS,SECRETARIA MUNICIPAL DE SAÚDE E ASSISTÊNCIA SOCIAL,LEONIRA CORTEZ MAZZARDO - FISCAL SANITÁRIO,16/09/2016,6103290_448114.pdf
2017-08-03 08:56:04,CORSAN - NOVA PALMA,,Nova Palma,4,,3710,22/06/2016,SAA,SIM,KARINE KOCHHANN RHODEN,SIM,NÃO,LEONIRA CORTEZ MAZZARDO,FISCAL SANITARIO - VISA E VIGIAGUA/SMSAS,SECRETARIA MUNICIPAL DE SAÚDE E ASSISTÊNCIA SOCIAL,LEONIRA CORTEZ MAZZARDO - FISCAL SANITÁRIO,05/06/2017,6103433_448114.pdf
2017-08-03 08:57:05 (2017-07-13 16:03:22),ASSOCIAÇÃO ÁGUA POTAVEL VILA TIMBAUVA BAIXA 01,,Cândido Godói,14,,90,12/07/2017,SAC,NÃO,,SIM,,VALDIR SACKS,FISCAL SANITARIO,VIGILANCIA SANITáRIA - SAUDE,VALDIR SACKS - FISCAL SANITÁRIOJOSÉ DE SOUZA MATOS - AGENTE SANITÁRIO,12/07/2017,5999177_448114.pdf
2017-08-03 09:13:19,LINHA VENDRAME GRUPO (01),,Mariano Moro,11,,11,26/07/2017,SAC,SIM,VERA LUCIA DALPUPO,SIM,SIM,NILTON VENDRAME,FISCAL SANITÁRIO,SECRETARIA MUNICIPAL DE SAÚDE,NILTON VENDRAME- FISCAL SANITÁRIO,01/08/2017,6103594_448114.pdf
2017-08-03 09:27:07,SAC LINHA 1- BEVILAQUA,,Barão de Cotegipe,11,,28,01/07/2017,SAC,NÃO,,NÃO,SIM,Silvana Trierveiler,COORDENADORA VISA,Barão de Cotegipe- SECRETARIA DA SAÚDE,SILVANA TRIERVEILERMARCOS BEVILAQUA,03/08/2017,
2017-08-03 09:27:26 (2017-07-13 16:29:06),ASSOCIAÇÃO ÁGUA POTAVEL CASTELO BRANCO,,Cândido Godói,14,,88,10/07/2017,SAC,NÃO,,NÃO,,VALDIR SACKS,FISCAL SANITARIO,VIGILANCIA SANITÁRIA - SAUDE,VALDIR SACKS FISCAL SANITÁRIO JOSÉ DE SOUZA MATOS AGENTE SANITÁRIO,10/07/2017,5999412_448114.pdf
2017-08-03 10:16:20,SOCIEDADE DE ÁGUA LINHA BEIJA FLOR,,Colinas,16,,91,02/08/2017,SAC,SIM,ECO DIEHL,SIM,NÃO,Fabio Oscar Schardong,Supervisor do Setor se Sanidade Animal,Secretaria Municipal do Meio Ambiente,Fabio Oscar Schardong- Supervisor do Setor se Sanidade Animal,03/08/2017,6104359_448114.pdf
2017-08-03 10:17:46,REDE DE ÁGUA DA LINHA WESTFALIA,,Colinas,16,,111,02/08/2017,SAC,SIM,ECO DIEHL,SIM,NÃO,Fabio Oscar Schardong,Supervisor do Setor se Sanidade Animal,Secretaria Municipal do Meio Ambiente,Fabio Oscar Schardong- Supervisor do Setor se Sanidade Animal,03/08/2017,6104375_448114.pdf
2017-08-03 10:19:54,ASSOCIAÇÃO DE ABASTECIMENTO DE AGUA LINHA 31 DE OUTUBRO,,Colinas,16,,123,02/08/2017,SAC,SIM,ECO DIEHL,SIM,NÃO,Fabio Oscar Schardong,Supervisor do Setor se Sanidade Animal,Secretaria Municipal do Meio Ambiente,Fabio Oscar Schardong- Supervisor do Setor se Sanidade Animal,03/08/2017,6104396_448114.pdf
2017-08-03 10:21:12,SOCIEDADE ABASTECEDORA DE AGUA COLINAS,,Colinas,16,,1240,02/08/2017,SAC,SIM,ECO DIEHL,SIM,NÃO,Fabio Oscar Schardong,Supervisor do Setor se Sanidade Animal,Secretaria Municipal do Meio Ambiente,Fabio Oscar Schardong- Supervisor do Setor se Sanidade Animal,03/08/2017,6104410_448114.pdf
2017-08-03 10:22:11,SOCIEDADE ABASTECEDORA DE AGUA COLINAS,,Colinas,16,,1240,02/08/2017,SAC,SIM,ECO DIEHL,SIM,NÃO,Fabio Oscar Schardong,Supervisor do Setor se Sanidade Animal,Secretaria Municipal do Meio Ambiente,Fabio Oscar Schardong- Supervisor do Setor se Sanidade Animal,03/08/2017,6104419_448114.pdf
2017-08-03 10:23:31,SOCIEDADE DE ÁGUA LINHA ANO BOM,,Colinas,16,,373,02/08/2017,SAC,SIM,ECO DIEHL,SIM,NÃO,Fabio Oscar Schardong,Supervisor do Setor se Sanidade Animal,Secretaria Municipal do Meio Ambiente,Fabio Oscar Schardong- Supervisor do Setor se Sanidade Animal,03/08/2017,6104435_448114.pdf
2017-08-03 11:19:00,SAC,,Nonoai,11,,60,31/07/2017,SAC,NÃO,,NÃO,NÃO,ROSANIA DA SILVA,Fiscal Sanitário,Secretária Municipal de Saúde ( Prefeitura Municipal),ROSANIA DA SILVA- FISCAL SANITÁRIOELENITA CARESIA FERNANDES- FISCAL SANITÁRIO,03/08/2017,6105110_448114.doc
2017-08-03 11:25:56,SAC LINHA 5- DARIVA,,Barão de Cotegipe,11,,34,02/07/2017,SAC,NÃO,,NÃO,SIM,Silvana Trierveiler,CORDENADORA DA VISA,Barão de Cotegipe -SECRETARIA DA SAÚDE,SILVANA TRIERVEILERMARCOS BEVILAQUA,03/08/2017,6105188_448114.pdf
2017-08-03 11:32:06 (2017-08-03 09:53:10),SAC Beno Martin,,Senador Salgado Filho,14,,149,02/07/2017,SAC,NÃO,,SIM,SIM,Andrei Tampke,Agente da Vigilância Sanitária,Secretaria Municipal de Saúde,Andrei Tampke - Agente da Vigilância Sanitária,03/08/2017,6104075_448114.pdf
2017-08-03 11:35:02 (2017-08-01 11:26:34),SAC Helga Kupske,,Senador Salgado Filho,14,,267,01/08/2017,SAC,NÃO,,SIM,SIM,Andrei Tampke,Agente da Vigilância Sanitária,Secretaria Municipal de Saúde,Andrei Tampke- ag. vig. sanitária,01/08/2017,6091225_448114.pdf
2017-08-03 11:41:40 (2017-08-01 09:54:57),SAC Escola Guilherme carlson,,Senador Salgado Filho,14,,180,31/07/2017,SAC,NÃO,,SIM,SIM,Andrei Tampke,Agente da Vigilância Sanitária,Secretaria Municipal de Saúde,Andrei Tampke - Ag. Vig. Sanitária,01/08/2017,6090190_448114.pdf
2017-08-03 12:06:50,Sac Travessão Sede ,,Senador Salgado Filho,14,,535,03/08/2017,SAC,NÃO,,SIM,SIM,Andrei Tampke,Agente da Vigilância Sanitária,Secretaria Municipal de Saúde,Andrei Tampke - Agente da Vigilância Sanitária,03/08/2017,6105649_448114.pdf
2017-08-03 13:20:22,Aparecida I,,Serafina Corrêa,6,,30,04/01/2017,SAC,NÃO,,NÃO,SIM,Peter Ferronatto,Fiscal sanitário,Secretaria Municipal de saúde,Peter Ferronatto - Fiscal SanitárioPatrícia Betineli - Farmacêutica e Bioquímica ,02/08/2017,6106169_448114.pdf
2017-08-03 13:28:25,Arranque i,,Serafina Corrêa,6,,20,13/06/2017,SAC,NÃO,,NÃO,SIM,Peter Ferronatto,Fiscal sanitário,Secretaria Municipal de saúde,Peter Ferronatto - Fiscal SanitárioPatrícia Betineli - Farmacêutica e Bioquímica,02/08/2017,6106244_448114.pdf
2017-08-03 13:33:19,Camping Carreiro I,,Serafina Corrêa,6,,300,07/04/2017,SAC,NÃO,,SIM,SIM,Peter Ferronatto,Fiscal sanitário,Secretaria Municipal de saúde,Peter Ferronatto - Fiscal SanitárioPatrícia Betineli - Farmacêutica e Bioquímica,02/08/2017,6106299_448114.pdf
2017-08-03 13:36:02,ASSOCIAÇÃO ÁGUA POTAVEL Dr.CÂNDIDO GODÓI,,Cândido Godói,14,,109,14/07/2017,SAC,NÃO,,SIM,NÃO,VALDIR SACKS,FISCAL SANITARIO,VIGILANCIA SANITÁRIA - SECRETARIA MUNICIPAL DEA SAUDE,VALDIR SACKS FISCAL SANITÁRIOJOSÉ DE SOUZA MATOS AGENTE SANITÁRIO,14/08/2017,6106328_448114.pdf
2017-08-03 13:40:38,Camping Carreiro II,,Serafina Corrêa,6,,0,07/04/2017,SAC,NÃO,,SIM,SIM,Peter Ferronatto,Fiscal sanitário,Secretaria Municipal de saúde,Peter Ferronatto - Fiscal SanitárioPatrícia Betineli - Farmacêutica e Bioquímica,02/08/2017,6106378_448114.pdf
2017-08-03 13:42:49,Caravaggio Lª 9 I,,Serafina Corrêa,6,,30,04/04/2017,SAC,NÃO,,SIM,SIM,Peter Ferronatto,Fiscal sanitário,Secretaria Municipal de saúde,Peter Ferronatto - Fiscal SanitárioPatrícia Betineli - Farmacêutica e Bioquímica,,6106407_448114.pdf
2017-08-03 13:44:22,Caravaggio Lª 9 II,,Serafina Corrêa,6,,25,04/04/2017,SAC,NÃO,,SIM,SIM,Peter Ferronatto,Fiscal sanitário,Secretaria Municipal de saúde,Peter Ferronatto - Fiscal SanitárioPatrícia Betineli - Farmacêutica e Bioquímica,,6106425_448114.pdf
2017-08-03 13:46:23,Caravaggio Lª 13 I,,Serafina Corrêa,6,,27,04/01/2017,SAC,NÃO,,SIM,SIM,Peter Ferronatto,Fiscal sanitário,Secretaria Municipal de saúde,Peter Ferronatto - Fiscal SanitárioPatrícia Betineli - Farmacêutica e Bioquímica,,6106449_448114.pdf
2017-08-03 13:50:36,SAC PONTE PRATOS,,Tucunduva,14,,123 ,01/08/2017,SAC,NÃO,,SIM,NÃO,JOSE ONEIDE DE ALMEIDA,FISCAL SANITÁRIO,SECRETARIA MUNICIPAL DE SAÚDE ,José Oneide de Almeida - Fiscal Sanitário,,6106500_448114.pdf
2017-08-03 13:52:45,Fátima I,,Serafina Corrêa,6,,45,09/05/2017,SAC,NÃO,,SIM,SIM,Peter Ferronatto,Fiscal sanitário,Secretaria Municipal de saúde,Peter Ferronatto - Fiscal SanitárioPatrícia Betineli - Farmacêutica e Bioquímica,,6106526_448114.pdf
2017-08-03 13:55:49,Fátima II,,Serafina Corrêa,6,,30,09/05/2017,SAC,NÃO,,SIM,SIM,Peter Ferronatto,Fiscal sanitário,Secretaria Municipal de saúde,Peter Ferronatto - Fiscal SanitárioPatrícia Betineli - Farmacêutica e Bioquímica,,6106566_448114.pdf
2017-08-03 13:58:05,Monte Bérico I,,Serafina Corrêa,6,,96,13/06/2017,SAC,NÃO,,SIM,SIM,Peter Ferronatto,Fiscal sanitário,Secretaria Municipal de saúde,Peter Ferronatto - Fiscal SanitárioPatrícia Betineli - Farmacêutica e Bioquímica,,6106596_448114.pdf
2017-08-03 14:01:03,Salete I,,Serafina Corrêa,6,,56,17/05/2017,SAC,NÃO,,NÃO,SIM,Peter Ferronatto,Fiscal sanitário,Secretaria Municipal de saúde,Peter Ferronatto - Fiscal SanitárioPatrícia Betineli - Farmacêutica e Bioquímica,,6106628_448114.pdf
2017-08-03 14:09:15,Santin I,,Serafina Corrêa,6,,100,16/05/2017,SAC,NÃO,,SIM,SIM,Peter Ferronatto,Fiscal sanitário,Secretaria Municipal de saúde,Peter Ferronatto - Fiscal SanitárioPatrícia Betineli - Farmacêutica e Bioquímica,,6106711_448114.pdf
2017-08-03 14:10:04,ASSOCIAÇÃO ÁGUA POTAVEL TIMBAUVA 02,,Cândido Godói,14,,75,01/08/2017,SAC,NÃO,,NÃO,,VALDIR SACKS,FISCAL SANITARIO,VIGILANCIA SANITÁRIA - SECRETARIA MUNICIPAL DEA SAUDE,VALDIR SACKS FISCAL SANITÁRIOJOSE DE SOUZA MATOS AGENTE SANITÁRIO,01/08/2017,6106724_448114.pdf
2017-08-03 14:20:16,ASSOCIAÇÃO ÁGUA POTAVEL SILVA JARDIM CENTRO,,Cândido Godói,14,,163,11/07/2017,SAC,SIM,PAULO ROBERTO ÁGUIAR GONÇALVES,SIM,NÃO,VALDIR SACKS,FISCAL SANITARIO,VIGILANCIA SANITÁRIA - SECRETARIA MUNICIPAL DEA SAUDE,VALDIR SACKS FISCAL SANITÁRIOJOSÉ DE SOUZA MATOS AGENTE SANITÁRIO,11/07/2017,6106845_448114.pdf
2017-08-03 14:25:17,SÃO BRAZ,,Tucunduva,14,,108,27/08/2017,SAC,NÃO,,SIM,SIM,JOSE ONEIDE DE ALMEIDA,FISCAL SANITÁRIO,SECRETARIA MUNICIPAL DE SAÚDE,José Oneide de Almeida - Fiscal Sanitário,,6106888_448114.odt
2017-08-03 14:35:11,SÃO BRAZ,,Tucunduva,14,,108,27/07/2017,SAC,NÃO,,SIM,SIM,JOSE ONEIDE DE ALMEIDA,FISCAL SANITÁRIO,SECRETARIA MUNICIPAL DE SAÚDE,JOSE ONEIDE DE ALMEIDA - FISCAL SANITÁRIO,,6106975_448114.pdf
2017-08-03 15:13:39,SAC DISTRITO INDUSTRIAL,,Tucunduva,14,,30,03/08/2017,SAC,NÃO,,NÃO,SIM,JOSE ONEIDE DE ALMEIDA,FISCAL SANITÁRIO,SECRETARIA MUNICIPAL DE SAÚDE,JOSE ONEIDE DE ALMEIDA - FISCAL SANITARIO,,6107422_448114.pdf
2017-08-03 15:42:29,SAC COTRIROSA,,Tucunduva,14,,49 ,03/08/2017,SAC,NÃO,,NÃO,SIM,JOSE ONEIDE DE ALMEIDA,FISCAL SANITÁRIO,SECRETARIA MUNICIPAL DE SAÚDE,JOSE ONEIDE DE ALMEIDA - FISCAL SANITÁRIO,,6107799_448114.pdf
2017-08-03 16:08:26,SÃO SEBASTIÃO,,Alecrim,14,,162,11/07/2017,SAC,NÃO,,NÃO,,GIRNEI LUIS DIRINGS,FISCAL SANITARIO,SECRETARIA MUNICIPAL DE SAÚDE,GIRNEI LUIS DIRINGSFISCAL SANNITARIO,03/08/2017,
2017-08-03 16:37:00,SAC,,Nonoai,11,,75,31/07/2017,SAC,NÃO,,NÃO,NÃO,ROSANIA DA SILVA,Fiscal Sanitário,Secretária Municipal de Saúde ( Prefeitura Municipal),ROSANIA DA SILVA- FISCAL SANITÁRIOELENITA CARESIA FERNANDES- FISCAL SANITÁRIO,03/08/2017,6108427_448114.doc
2017-08-04 08:11:46,ASSOCIAÇÃO HÍDRICA SÃO JOÃO - CAPOEIRA GRANDE,,Venâncio Aires,13,,340,13/07/2017,SAC,SIM,LIGIANE ANGELA WEBER,SIM,SIM,CRISTIANE MARIA FABRIN STAUB,FISCAL SANITARIA,MUNICIPIO DE VENÂNCIO AIRES - SECRETARIA DE SAUDE - VISA,CRISTIANE MARIA FABRIN STAUB,01/08/2017,6110160_448114.pdf
2017-08-04 08:17:15 (2017-08-04 07:58:15),ASSOCIAÇÃO HÍDRICA TRAVESSÃO DO GAMBÁ,,Venâncio Aires,13,,130,13/07/2017,SAC,SIM,LIGIANE ANGELA WEBER,SIM,NÃO,CRISTIANE MARIA FABRIN STAUB,FISCAL SANITARIA,MUNICIPIO DE VENÂNCIO AIRES - SECRETARIA DE SAUDE - VISA,CRISTIANE MARIA FABRIN STAUB,01/08/2017,6110041_448114.pdf
2017-08-04 08:47:33,ASSOCIAÇÃO HÍDRICA SÃO JORGE,,Venâncio Aires,13,,110,19/04/2017,SAC,SIM,LIGIANE ANGELA WEBER,SIM,SIM,CRISTIANE MARIA FABRIN STAUB,FISCAL SANITARIA,MUNICIPIO DE VENÂNCIO AIRES - SECRETARIA DE SAUDE - VISA,CRISTIANE MARIA FABRIN STAUB,03/07/2017,6110481_448114.pdf
2017-08-04 09:45:19,SAC BAIRRO MOURA,,Giruá,14,,322,10/07/2017,SAC,NÃO,,NÃO,SIM,LUIZ FERNANDO SCHWERZ,FISCAL SANITARIO,SECRETARIA MUNICIPAL DE SAÚDE,LUIZ FERNANDO SCHWERZ - FISCAL SANITARIORICARDO FERNANDO THOM - AGENTE SANITARISTA,04/08/2017,6111024_448114.pdf
2017-08-04 10:03:55,SAC PARQUE DE EXPOSIÇÕES OLMIRO CALLAI,,Giruá,14,,41,18/07/2017,SAC,SIM,PAULO ROBERTO AGUIAR GONÇALVES,SIM,NÃO,LUIZ FERNANDO SCHWERZ,FISCAL SANITARIO,SECRETARIA MUNICIPAL DE SAÚDE,LUIZ FERNANDO SCHWERZ - FISCAL SANITÁRIORICARDO FERNANDO THOM - AGENTE SANITARISTA,04/08/2017,6111233_448114.pdf
2017-08-04 10:06:49,ASSOCIAÇÃO VILA ESPERANÇA,,Campina das Missões,14,,300,03/08/2017,SAC,NÃO,,NÃO,NÃO,ALCIDES,FISCAL SANITÁRIO,SECRETARIA MUNICIPAL DE SAUDE,ALCIDES JOSÉ KIRSCH E ARTEMIO BLASIO ANSCHAU,04/08/2017,6111253_448114.pdf
2017-08-04 10:20:50,SAC RINCÃO DOS CARVALHO,,Giruá,14,,52,18/07/2017,SAC,NÃO,,NÃO,SIM,LUIZ FERNANDO SCHWERZ,FISCAL SANITARIO,SECRETARIA MUNICIPAL DE SAÚDE,LUIZ FERNANDO SCHWERZ - FISCAL SANITARIORICARDO FERNANDO THOM - AGENTE SANITARISTA,04/08/2017,6111407_448114.pdf
2017-08-04 10:40:30,SAC BELA VISTA,,Giruá,14,,45,19/07/2017,SAC,NÃO,,NÃO,SIM,LUIZ FERNANDO SCHWERZ,FISCAL SANITARIO,SECRETARIA MUNICIPAL DE SAÚDE,LUIZ FERNANDO SCHWERZ - FISCAL SANITARIORICARDO FERNANDO THOM - AGENTE SANITARISTA,04/08/2017,6111621_448114.pdf
2017-08-04 10:42:16,SAC Volta Grande, Três Bocas I,,Porto Mauá,14,,100,04/08/2017,SAC,NÃO,,NÃO,,Ricardo Jose Dirings,Vigilante Sanitario,Secretaria Municipal de Saúde,Ricardo José Dirings - Vigilante Sanitário,04/08/2017,
2017-08-04 10:54:34,SAC RINCÃO TIMBAÚVA,,Giruá,14,,18,19/07/2017,SAC,NÃO,,NÃO,SIM,LUIZ FERNANDO SCHWERZ,FISCAL SANITARIO,SECRETARIA MUNICIPAL DE SAÚDE,LUIZ FERNANDO SCHWERZ - FISCAL SANITÁRIORICARDO FERNANDO THOM - AGENTE SANITARISTA,04/08/2017,6111794_448114.pdf
2017-08-04 10:56:05,SAC Volta Grande, Três Bocas II,,Porto Mauá,14,,67,04/08/2017,SAC,NÃO,,NÃO,,Ricardo Jose Dirings,Vigilante Sanitario,Secretaria Municipal de Saúde,Ricardo José Dirings - Vigilante Sanitário,04/08/2017,
2017-08-04 11:04:08,SAC Itajuba I,,Porto Mauá,14,,76,04/08/2017,SAC,NÃO,,NÃO,,Ricardo Jose Dirings,Vigilante Sanitario,Secretaria Municipal de Saúde,Ricardo José Dirings - Vigilante Sanitário,04/08/2017,
2017-08-04 11:12:07,SAC Itajuba II,,Porto Mauá,14,,70,04/08/2017,SAC,NÃO,,NÃO,,Ricardo Jose Dirings,Vigilante Sanitario,Secretaria Municipal de Saúde,Ricardo José Dirings - Vigilante Sanitário,04/08/2017,
2017-08-04 11:21:22 (2017-08-03 16:12:09),SAC NOVA VIDA,,São Paulo das Missões,14,,234,14/07/2017,SAC,SIM,ALVARO LUIS MALVESTI,SIM,SIM,Marcia Weyh Werle Tozevich,Fiscal Municipal,Prefeitura Municipal de São Paulo das Missões,MARCIA WEYH WERLE TOZEVICH FISCAL MUNICIPAL,03/08/2017,6108140_448114.pdf
2017-08-04 13:07:01,Santo Antônio Lajeado I,,Serafina Corrêa,6,,6,25/05/2017,SAC,NÃO,,NÃO,SIM,Peter Ferronatto,Fiscal sanitário,Secretaria Municipal de saúde,Peter Ferronatto - Fiscal SanitárioPatrícia Betineli - Farmacêutica e Bioquímica,,6112875_448114.pdf
2017-08-04 13:09:03,Santo Antônio Lajeado II,,Serafina Corrêa,6,,18,25/05/2017,SAC,NÃO,,NÃO,SIM,Peter Ferronatto,Fiscal sanitário,Secretaria Municipal de saúde,Peter Ferronatto - Fiscal SanitárioPatrícia Betineli - Farmacêutica e Bioquímica,,6112895_448114.pdf
2017-08-04 13:11:04,São Caetano I,,Serafina Corrêa,6,,70,09/05/2017,SAC,NÃO,,SIM,SIM,Peter Ferronatto,Fiscal sanitário,Secretaria Municipal de saúde,Peter Ferronatto - Fiscal SanitárioPatrícia Betineli - Farmacêutica e Bioquímica,,6112905_448114.pdf
2017-08-04 13:12:58,Santo Antônio I,,Serafina Corrêa,6,,50,25/05/2017,SAC,NÃO,,SIM,SIM,Peter Ferronatto,Fiscal sanitário,Secretaria Municipal de saúde,Peter Ferronatto - Fiscal SanitárioPatrícia Betineli - Farmacêutica e Bioquímica,,6112923_448114.pdf
2017-08-04 13:14:34,São Carlos II,,Serafina Corrêa,6,,40,07/06/2017,SAC,NÃO,,SIM,SIM,Peter Ferronatto,Fiscal sanitário,Secretaria Municipal de saúde,Peter Ferronatto - Fiscal SanitárioPatrícia Betineli - Farmacêutica e Bioquímica,,6112934_448114.pdf
2017-08-04 13:17:34,São Carlos III,,Serafina Corrêa,6,,15,06/06/2017,SAC,NÃO,,NÃO,SIM,Peter Ferronatto,Fiscal sanitário,Secretaria Municipal de saúde,Peter Ferronatto - Fiscal SanitárioPatrícia Betineli - Farmacêutica e Bioquímica,,6112969_448114.pdf
2017-08-04 13:34:08,São João I,,Serafina Corrêa,6,,120,07/04/2017,SAC,SIM,Altasul,SIM,SIM,Peter Ferronatto,Fiscal sanitário,Secretaria Municipal de saúde,Peter Ferronatto - Fiscal SanitárioPatrícia Betineli - Farmacêutica e Bioquímica,,6113126_448114.pdf
2017-08-04 13:35:03,SAC UNIÃO OPERARIA,,São Paulo das Missões,14,,259,12/07/2017,SAC,SIM,ALVARO LUIS MALVESTI,SIM,NÃO,Marcia Weyh Werle Tozevich,Fiscal Municipal,Prefeitura Municipal de São Paulo das Missões,Marcia Weyh Werle Tozevich fiscal muicipal,03/08/2017,6113139_448114.pdf
2017-08-04 13:36:11,São João II,,Serafina Corrêa,6,,105,07/04/2017,SAC,NÃO,,NÃO,SIM,Peter Ferronatto,Fiscal sanitário,Secretaria Municipal de saúde,Peter Ferronatto - Fiscal SanitárioPatrícia Betineli - Farmacêutica e Bioquímica,,6113152_448114.pdf
2017-08-04 13:39:32,Bairro São Paulo ,,São Paulo das Missões,14,,1084,12/07/2017,SAC,SIM,ALVARO LUIS MALVESTI,SIM,SIM,Marcia Weyh Werle Tozevich,Fiscal Municipal,Prefeitura Municipal de São Paulo das Missões,Marcia Weyh Werle Tozevich Fiscal Municipal,,6113193_448114.pdf
2017-08-04 13:48:27,ASSOCIAÇÃO COMANDAI,,Campina das Missões,14,,130,03/08/2017,SAC,NÃO,,NÃO,NÃO,ALCIDES KIRSCH,FISCAL SANITÁRIO,SECRETARIA MUNICIPAL DE SAUDE,ALCIDES KIRSCH - FISCAL SANITÁRIOARTEMIO BLASIO ANSCHAU -  FISCAL SANITÁRIO,04/08/2017,6113266_448114.pdf
2017-08-04 13:52:39,São José I,,Serafina Corrêa,6,,35,04/04/2017,SAC,NÃO,,SIM,SIM,Peter Ferronatto,Fiscal sanitário,Secretaria Municipal de saúde,Peter Ferronatto - Fiscal SanitárioPatrícia Betineli - Farmacêutica e Bioquímica,,6113302_448114.pdf
2017-08-04 13:54:57,AMADEU SUL,,Campina das Missões,14,,120,03/08/2017,SAC,NÃO,,NÃO,NÃO,ALCIDES KIRSCH,FISCAL SANITÁRIO,SECRETARIA MUNICIPAL DE SAÚDE,ALCIDES JOSÉ KIRSCH - FISCAL SANITÁRIOARTEMIO BLSAIO ANSCHAU - FISCAL SANITÁRIO,04/08/2017,6113320_448114.pdf
2017-08-04 13:58:36,São José II,,Serafina Corrêa,6,,20,04/04/2017,SAC,NÃO,,SIM,SIM,Peter Ferronatto,Fiscal sanitário,Secretaria Municipal de saúde,Peter Ferronatto - Fiscal SanitárioPatrícia Betineli - Farmacêutica e Bioquímica,,6113352_448114.pdf
2017-08-04 13:59:01,ASSOCIAÇÃO AMDEU NIQUEL SUL,,Campina das Missões,14,,130,03/08/2017,SAC,NÃO,,NÃO,NÃO,ALCIDES KIRSCH,FISCAL SANITÁRIO,SECRETARIA MUNICIPAL DE SAÚDE,ALCIDES JOSÉ KIRSCH - FISCAL SANITÁRIOARTEMIO BLASIO ANSCHAU - FISCAL SANITÁRIO,04/08/2017,6113359_448114.pdf
2017-08-04 14:00:50,São José III,,Serafina Corrêa,6,,25,04/04/2017,SAC,NÃO,,NÃO,SIM,Peter Ferronatto,Fiscal sanitário,Secretaria Municipal de saúde,Peter Ferronatto - Fiscal SanitárioPatrícia Betineli - Farmacêutica e Bioquímica,,6113378_448114.pdf
2017-08-04 14:08:24,São Luís,,Serafina Corrêa,6,,22,16/05/2017,SAC,NÃO,,NÃO,SIM,Peter Ferronatto,Fiscal sanitário,Secretaria Municipal de saúde,Peter Ferronatto - Fiscal SanitárioPatrícia Betineli - Farmacêutica e Bioquímica,,6113434_448114.pdf
2017-08-04 14:14:52,São Luís II,,Serafina Corrêa,6,,12,09/05/2017,SAC,NÃO,,SIM,SIM,Peter Ferronatto,Fiscal sanitário,Secretaria Municipal de saúde,Peter Ferronatto - Fiscal SanitárioPatrícia Betineli - Farmacêutica e Bioquímica,,6113492_448114.pdf
2017-08-04 14:24:48,SAC,,Nonoai,11,,48 ,31/07/2017,SAC,NÃO,,NÃO,NÃO,ROSANIA DA SILVA,Fiscal Sanitário,Secretária Municipal de Saúde ( Prefeitura Municipal),ROSANIA DA SILVA- FISCAL SANITÁRIOELENITA CARESIA FERNANDES- FISCAL SANITÁRIO,04/08/2017,6113588_448114.doc
2017-08-04 14:43:36,SAC,,Nonoai,11,,63,31/07/2017,SAC,NÃO,,NÃO,NÃO,ROSANIA DA SILVA,Fiscal Sanitário,Secretária Municipal de Saúde ( Prefeitura Municipal),ROSANIA DA SILVA- FISCAL SANITÁRIOELENITA CARESIA FERNANDES- FISCAL SANITÁRIO,04/08/2017,6113798_448114.doc
2017-08-04 15:10:02,SAC,,Nonoai,11,,46,31/07/2017,SAC,NÃO,,NÃO,NÃO,ROSANIA DA SILVA,Fiscal Sanitário,Secretária Municipal de Saúde ( Prefeitura Municipal),ROSANIA DA SILVA- FISCAL SANITÁRIOELENITA CARESIA FERNANDES- FISCAL SANITÁRIO,04/08/2017,6114154_448114.doc
2017-08-04 16:13:48,SAC TIGRE I,,Severiano de Almeida,11,,24,22/06/2017,SAC,NÃO,,NÃO,,Alan Junior Solivo,Fiscal Sanitário,Secretaria Municipal de Saúde,ALAN JUNIOR SOLIVOLUCAS EDUARDO RIBEIRO,04/08/2017,6114886_448114.pdf
2017-08-04 16:16:28,SAC TIGRE II,,Severiano de Almeida,11,,21,22/06/2017,SAC,NÃO,,NÃO,,Alan Junior Solivo,Fiscal Sanitário,Secretaria Municipal de Saúde,ALAN JUNIOR SOLIVOLUCAS EDUARDO RIBEIRO,04/08/2017,6114905_448114.pdf
2017-08-04 16:21:54,SAC TIGRE III,,Severiano de Almeida,11,,52,22/06/2017,SAC,SIM,Vera L. P. Dal Pupo,SIM,NÃO,Alan Junior Solivo,Fiscal Sanitário,Secretaria Municipal de Saúde,ALAN JUNIOR SOLIVOLUCAS EDUARDO RIBEIRO,04/08/2017,6114966_448114.pdf
2017-08-04 16:24:41,CARACOL I,,Severiano de Almeida,11,,82,20/07/2017,SAC,NÃO,,NÃO,,Alan Junior Solivo,Fiscal Sanitário,Secretaria Municipal de Saúde,ALAN JUNIOR SOLIVOLUCAS EDUARDO RIBEIRO,04/08/2017,6114993_448114.pdf
2017-08-04 16:26:59,CARACOL II,,Severiano de Almeida,11,,12,20/07/2017,SAC,NÃO,,NÃO,,Alan Junior Solivo,Fiscal Sanitário,Secretaria Municipal de Saúde,ALAN JUNIOR SOLIVOLUCAS EDUARDO RIBEIRO,04/08/2017,6115023_448114.pdf
2017-08-07 10:05:12,SAC LINHA MALINSKI,,Barão de Cotegipe,11,,25,02/07/2017,SAC,NÃO,,NÃO,SIM,Silvana Trierveiler,COORDENADORA VISA,PREFEITURA DE BARÃO DE COTEGIPE-SECRETARIA DA SAÚDE,SILVANA TRIERVEILERMARCOS BEVILAQUA,07/08/2017,6120516_448114.pdf
2017-08-07 11:12:43 (2017-08-07 10:43:23),SAC Linha do Meio,,Centenário,11,,37,25/05/2017,SAC,SIM,Marta Menosso Acorsi,SIM,SIM,Janalice Ana Kessler,Agente de Combate a Endemias,Secretária Municipal de Saúde,Janalice Ana Kessler - Agente de Combate a EndemiasGraciele Butrinoski - Fiscal Sanitário,07/08/2017,6120995_448114.docx
2017-08-07 11:12:47 (2017-08-07 10:43:24),SAC LINHA POLLOM,,Centenário,11,,100,24/07/2017,SAC,SIM,MARTA MENOSSO ACORSI,SIM,NÃO,JANALICE ANA KESSLER,AGENTE DE COMBATE A ENDEMIAS,SECRETARIA MUNICIPAL DA SAÚDE,JANALICE ANA KESSLER - AGENTE DE COMBATE A ENDEMIASGRACIELE BUTRINOSKI - FISCAL SANITÁRIO,07/08/2017,6120997_448114.docx
2017-08-07 13:23:07,IDN-12,,Independência,14,,4514,01/08/2017,SAA,SIM,PLUTARCO ARISTIDES GERMANO SOARES MARQUES,SIM,NÃO,KLEBER JUNG,ENFERMEIRO,SECRETARIA MUNICIPAL DE SAÚDE DE INDEPENDÊNCIA,KLEBER JUNG,03/08/2017,6122754_448114.pdf
2017-08-07 14:29:17 (2017-07-19 11:20:42),sac Linha jundiá usina,,,São José do Inhacorá,14,,84,12/07/2017,SAC,NÃO,,SIM,SIM,Milton Ruppenthal,Fiscal Sanitário,secretaria municipal de saúde,secretaria municipal de saúde,Não há equipe de inspeção, apenas o fiscal sanitário.,19/07/2017,6022407_448114.pdf
2017-08-07 15:12:00 (2017-07-19 10:47:16), SAC lajeado itu caramuru,,São José do Inhacorá,14,,113,12/07/2017,SAC,NÃO,,SIM,NÃO,Milton Ruppenthal,Fiscal Sanitário,secretaria municipal de saúde,não há equipe de inspeção. Apenas o fiscal sanitário.,19/07/2017,6021995_448114.pdf
2017-08-07 15:26:28 (2017-07-19 10:57:21),SAC Linha central II.,,São José do Inhacorá,14,,29,12/07/2017,SAC,NÃO,,SIM,NÃO,Milton Ruppenthal,Fiscal Sanitário,,secretaria municipal de saúde,secretaria municipal de saúde,Não há equipe de inspeção. Apenas o fiscal sanitário.,19/07/2017,6022088_448114.pdf
2017-08-07 16:15:04 (2017-07-26 11:03:52),sac linha giacomelli,,,São José do Inhacorá,14,,87,10/07/2017,SAC,NÃO,,SIM,NÃO,Milton Ruppenthal,Fiscal Sanitário,secretaria municipal de saúde,não há equipe de inspeção, apenas o fiscal sanitário.,26/07/2017,6054198_448114.pdf
2017-08-08 08:16:24,São Paulo I,,Serafina Corrêa,6,,30,04/01/2017,SAC,NÃO,,SIM,SIM,Peter Ferronatto,Fiscal sanitário,Secretaria Municipal de saúde,Peter Ferronatto - Fiscal SanitárioPatrícia Betineli - Farmacêutica e Bioquímica,,6127553_448114.pdf
2017-08-08 08:33:04,São Paulo II,,Serafina Corrêa,6,,80,04/01/2017,SAC,NÃO,,NÃO,SIM,Peter Ferronatto,Fiscal sanitário,Secretaria Municipal de saúde,Peter Ferronatto - Fiscal SanitárioPatrícia Betineli - Farmacêutica e Bioquímica,,6127678_448114.pdf
2017-08-08 08:38:41,São Pedro I,,Serafina Corrêa,6,,250,07/04/2017,SAC,NÃO,,SIM,NÃO,Peter Ferronatto,Fiscal sanitário,Secretaria Municipal de saúde,Peter Ferronatto - Fiscal SanitárioPatrícia Betineli - Farmacêutica e Bioquímica,,6127720_448114.pdf
2017-08-08 08:49:45,São Roque I,,Serafina Corrêa,6,,30,09/06/2017,SAC,NÃO,,SIM,SIM,Peter Ferronatto,Fiscal sanitário,Secretaria Municipal de saúde,Peter Ferronatto - Fiscal SanitárioPatrícia Betineli - Farmacêutica e Bioquímica,,6127830_448114.pdf
2017-08-08 08:51:40,São Roque II,,Serafina Corrêa,6,,24,12/06/2017,SAC,NÃO,,SIM,SIM,Peter Ferronatto,Fiscal sanitário,Secretaria Municipal de saúde,Peter Ferronatto - Fiscal SanitárioPatrícia Betineli - Farmacêutica e Bioquímica,,6127847_448114.pdf
2017-08-08 08:54:19,São Roque III,,Serafina Corrêa,6,,30,04/04/2017,SAC,NÃO,,SIM,SIM,Peter Ferronatto,Fiscal sanitário,Secretaria Municipal de saúde,Peter Ferronatto - Fiscal SanitárioPatrícia Betineli - Farmacêutica e Bioquímica,,6127880_448114.pdf
2017-08-08 08:55:48,São Roque IV,,Serafina Corrêa,6,,42,09/06/2017,SAC,NÃO,,SIM,SIM,Peter Ferronatto,Fiscal sanitário,Secretaria Municipal de saúde,Peter Ferronatto - Fiscal SanitárioPatrícia Betineli - Farmacêutica e Bioquímica,,6127898_448114.pdf
2017-08-08 09:02:21 (2017-08-04 16:16:17),SECÇÃO ENSEADAS,,Doutor Maurício Cardoso,14,,129,26/06/2017,SAC,NÃO,,NÃO,SIM,LAIS COELHO TEIXEIRA,FISCAL SANITARIO,SECRETARIA MUNICIPAL DE SAUDE DE DOUTOR MAURICIO CARDOSO,LAIS TEIXEIRA - FISCAL SANITARIORENAN BERNARDI - FISCAL AMBIENTAL,04/08/2017,6114904_448114.pdf
2017-08-08 09:06:19 (2017-08-04 16:21:32),VILA PRANCHADA ,,Doutor Maurício Cardoso,14,,283,26/06/2017,SAC,NÃO,,NÃO,SIM,LAIS COELHO TEIXEIRA,FISCAL SANITARIO,SECRETARIA MUNICIPAL DE SAUDE DE DOUTOR MAURICIO CARDOSO,LAIS TEIXEIRA - FISCAL SANITARIORENAN BERNARDI - FISCAL AMBIENTAL,04/08/2017,6114959_448114.pdf
2017-08-08 09:08:32 (2017-08-04 16:09:16),ESQUINA ANDRADES POÇO 02,,Doutor Maurício Cardoso,14,,47,26/07/2017,SAC,NÃO,,NÃO,SIM,LAIS COELHO TEIXEIRA,FISCAL SANITARIO,SECRETARIA MUNICIPAL DE SAUDE DE DOUTOR MAURICIO CARDOSO,LAIS TEIXEIRA - FISCAL SANITARIORENAN BERNARDI - FISCAL AMBIENTAL,04/08/2017,6114826_448114.pdf
2017-08-08 09:09:35,Saúde I,,Serafina Corrêa,6,,50,16/05/2017,SAC,NÃO,,SIM,SIM,Peter Ferronatto,Fiscal sanitário,Secretaria Municipal de saúde,Peter Ferronatto - Fiscal SanitárioPatrícia Betineli - Farmacêutica e Bioquímica,,6128044_448114.pdf
2017-08-08 09:11:19,Saúde II,,Serafina Corrêa,6,,60,17/05/2017,SAC,NÃO,,SIM,NÃO,Peter Ferronatto,Fiscal sanitário,Secretaria Municipal de saúde,Peter Ferronatto - Fiscal SanitárioPatrícia Betineli - Farmacêutica e Bioquímica,,6128061_448114.pdf
2017-08-08 09:11:49 (2017-08-04 16:12:08),ESQUINA ANDRADES POÇO 01,,Doutor Maurício Cardoso,14,,123,26/07/2017,SAC,NÃO,,NÃO,SIM,LAIS COELHO TEIXEIRA,FISCAL SANITARIO,SECRETARIA MUNICIPAL DE SAUDE DE DOUTOR MAURICIO CARDOSO,LAIS TEIXEIRA - FISCAL SANITARIORENAN BERNARDI - FISCAL AMBIENTAL,04/08/2017,6114862_448114.pdf
2017-08-08 09:14:28,Saúde III,,Serafina Corrêa,6,,15,16/05/2017,SAC,NÃO,,SIM,SIM,Peter Ferronatto,Fiscal sanitário,Secretaria Municipal de saúde,Peter Ferronatto - Fiscal SanitárioPatrícia Betineli - Farmacêutica e Bioquímica,,6128105_448114.pdf
2017-08-08 09:16:51,Saúde IV,,Serafina Corrêa,6,,18,16/05/2017,SAC,NÃO,,NÃO,SIM,Peter Ferronatto,Fiscal sanitário,Secretaria Municipal de saúde,Peter Ferronatto - Fiscal SanitárioPatrícia Betineli - Farmacêutica e Bioquímica,,6128129_448114.pdf
2017-08-08 09:20:11,Silva Jardim I,,Serafina Corrêa,6,,55,13/06/2017,SAC,NÃO,,NÃO,SIM,Peter Ferronatto,Fiscal sanitário,Secretaria Municipal de saúde,Peter Ferronatto - Fiscal SanitárioPatrícia Betineli - Farmacêutica e Bioquímica,,6128159_448114.pdf
2017-08-08 09:22:01,Silva Jardim II,,Serafina Corrêa,6,,240,12/06/2017,SAC,SIM,La Fontana,SIM,NÃO,Peter Ferronatto,Fiscal sanitário,Secretaria Municipal de saúde,Peter Ferronatto - Fiscal SanitárioPatrícia Betineli - Farmacêutica e Bioquímica,,6128173_448114.pdf
2017-08-08 09:23:58,Silva Jardim III,,Serafina Corrêa,6,,18,12/06/2017,SAC,NÃO,,SIM,SIM,Peter Ferronatto,Fiscal sanitário,Secretaria Municipal de saúde,Peter Ferronatto - Fiscal SanitárioPatrícia Betineli - Farmacêutica e Bioquímica,,6128198_448114.pdf
2017-08-08 09:25:48,São Francisco I,,Serafina Corrêa,6,,40,25/05/2017,SAC,NÃO,,NÃO,SIM,Peter Ferronatto,Fiscal sanitário,Secretaria Municipal de saúde,Peter Ferronatto - Fiscal SanitárioPatrícia Betineli - Farmacêutica e Bioquímica,,6128213_448114.pdf
2017-08-08 15:19:56,LAJEADO TARAIRA,,Alecrim,14,,,11/07/2017,SAC,NÃO,,,,GIRNEI LUIS DIRINGS,FISCAL SANITARIO,SECRETARIA MUNICIPAL DE SAÚDE,GIRNEI LUIS DIRINGSFISCAL SANITARIO,08/08/2017,
2017-08-08 15:24:01,LAJEADO CHIMÃ,,Alecrim,14,,,11/07/2017,SAC,NÃO,,NÃO,,GIRNEI LUIS DIRINGS,FISCAL SANITARIO,SECRETARIA MUNICIPAL DE SAÚDE,GIRNEI LUIS DIRINGSFISCAL SANITARIO,08/08/2017,
2017-08-09 10:35:12 (2017-08-04 16:53:14),SAC LINHA DIVISA,,Santo Cristo,14,,165 ,04/08/2017,SAC,NÃO,,NÃO,SIM,Carla Marlise Kensy,FISCAL SANITÁRIA,SECRETARIA MUNICIPAL DA SAÚDE,Carla Marlise Kensy - Fiscal Sanitária,04/08/2017,6115273_448114.pdf
2017-08-09 10:43:03 (2017-08-04 17:05:07),SAC CONTORNO DA CIDADE,,Santo Cristo,14,,53,04/08/2017,SAC,NÃO,,NÃO,SIM,Carla Marlise Kensy,FISCAL SANITÁRIA,SECRETARIA MUNICIPAL DA SAÚDE,Carla Marlise Kensy - Fiscal Sanitária,04/08/2017,6115373_448114.pdf
2017-08-09 10:44:09 (2017-08-04 16:47:50),SAC LINHA SALTO,,Santo Cristo,14,,410,04/08/2017,SAC,NÃO,,NÃO,SIM,Carla Marlise Kensy,FISCAL SANITÁRIA,SECRETARIA MUNICIPAL DA SAÚDE,Carla Marlise Kensy Fiscal Sanitária,04/08/2017,6115218_448114.pdf
2017-08-09 10:45:55,SAC LINHA DAS ANTAS/ROLADOR ALTO/TRÊS LAJEADOS,,Santo Cristo,14,,374,04/08/2017,SAC,NÃO,,NÃO,SIM,Carla Marlise Kensy,FISCAL SANITÁRIA,SECRETARIA MUNICIPAL DA SAÚDE,Carla Marlise Kensy - Fiscal Sanitária,09/08/2017,6136305_448114.pdf
2017-08-09 10:52:59,ASSOCIAÇÃO HÍDRICA SANTA TECLA,,Venâncio Aires,13,,160,13/07/2017,SAC,SIM,LIGIANE ANGELA WEBER,SIM,SIM,CRISTIANE MARIA FABRIN STAUB,FISCAL SANITARIA,MUNICIPIO DE VENÂNCIO AIRES - SECRETARIA DE SAUDE - VISA,CRISTIANE MARIA FABRIN STAUB,07/08/2017,6136430_448114.pdf
2017-08-09 10:58:57,ASSOCIAÇÃO HÍDRICA DE LINHA HERVAL,,Venâncio Aires,13,,520,13/07/2017,SAC,SIM,LIGIANE ANGELA WEBER,SIM,NÃO,CRISTIANE MARIA FABRIN STAUB,FISCAL SANITARIA,MUNICIPIO DE VENÂNCIO AIRES - SECRETARIA DE SAUDE - VISA,CRISTIANE MARIA FABRIN STAUB,09/08/2017,6136536_448114.pdf
2017-08-09 11:07:43,ASSOCIAÇÃO DO POÇO ARTESIANO 25 DE JULHO - VILA TERESINHA,,Venâncio Aires,13,,90,13/07/2017,SAC,SIM,LIGIANE ANGELA WEBER,SIM,SIM,CRISTIANE MARIA FABRIN STAUB,FISCAL SANITARIA,MUNICIPIO DE VENÂNCIO AIRES - SECRETARIA DE SAUDE - VISA,CRISTIANE MARIA FABRIN STAUB,09/08/2017,6136669_448114.pdf
2017-08-09 14:33:51,SAC CÂNDIDO FREIRE,,Giruá,14,,159,09/08/2017,SAC,NÃO,,NÃO,SIM,LUIZ FERNANDO SCHWERZ,FISCAL SANITARIO,SECRETARIA MUNICIPAL DE SAÚDE,LUIZ FERNANDO SCHWERZ - FISCAL SANITÁRIORICARDO FERNANDO THOM - AGENTE SANITARISTA,,6138938_448114.pdf
2017-08-09 14:44:27,SAC BOCA DA PICADA 2,,Giruá,14,,66,09/08/2017,SAC,NÃO,,NÃO,NÃO,LUIZ FERNANDO SCHWERZ,FISCAL SANITARIO,SECRETARIA MUNICIPAL DE SAÚDE,LUIZ FERNANDO SCHWERZ - FISCAL SANITÁRIORICARDO FERNANDO THOM - AGENTE SANITARISTA,,6139095_448114.pdf
2017-08-10 07:38:30,ASSOCIAÇÃO HÍDRICA ALTO 25 DE JULHO,,Venâncio Aires,13,,70,13/07/2017,SAC,SIM,LIGIANE ANGELA WEBER,SIM,SIM,CRISTIANE MARIA FABRIN STAUB,FISCAL SANITARIA,MUNICIPIO DE VENÂNCIO AIRES - SECRETARIA DE SAUDE - VISA,CRISTIANE MARIA FABRIN STAUB,09/08/2017,6141919_448114.pdf
2017-08-11 08:35:56,ASSOCIAÇÃO HÍDRICA SÃO MARCOS,,Venâncio Aires,13,,310,13/07/2017,SAC,SIM,LIGIANE ANGELA WEBER,SIM,NÃO,CRISTIANE MARIA FABRIN STAUB,FISCAL SANITARIA,MUNICIPIO DE VENÂNCIO AIRES - SECRETARIA DE SAUDE - VISA,CRISTIANE MARIA FABRIN STAUB,09/08/2017,6149711_448114.pdf
2017-08-11 09:15:36,ASSOCIAÇÃO LINHA PROGRESSO,,Cruzaltense,11,,132,21/06/2017,SAC,SIM,JEAN CARLOS MERG,NÃO,SIM,VAGNER SANDRI,FISCAL AMBIENTA/SANITÁRIO/ URBANISMO,SECRETARIA MUNICIPAL DE SAUDE,Adriane Boniatti (Coordenadora da Visa)Vagner Sandri (Fiscal Ambiental/Sanitário/Urbanismo),11/08/2017,6150046_448114.pdf
2017-08-11 09:33:53,SAC LINHA ESPORTIVO,,Paulo Bento,11,,41,14/07/2017,SAC,NÃO,,NÃO,,RENATO IVAN GROMANN,VIGILANTE SANITARIO E AMBIENTAL EM SAUDE,SECRETARIA MUNICIPAL DE SAUDE,RENATO GROMANN - VIGILANTE SANITARIO E AMBIENTAL EM SAUDECAREN C.GOLLO - COORDENADORA VISA,10/08/2017,6150204_448114.pdf
2017-08-11 09:38:22,LINHA POVOADO COAN,,Erechim,11,,99,26/06/2017,SAC,NÃO,,NÃO,SIM,FILOMENA REVERS,FISCAL SANITÁRIO E MEIO AMBIENTE,SECRETÁRIA MUNICIPAL DE SAÚDE,FILOMENA REVERS - FISCAL SANITÁRIO E MEIO AMBIENTE,26/06/2017,6150242_448114.pdf
2017-08-11 09:44:51,LINHA DESVIO BECKER,,Erechim,11,,93,20/06/2017,SAC,NÃO,,NÃO,SIM,FILOMENA REVERS,FISCAL SANITÁRIO E MEIO AMBIENTE,SECRETÁRIA MUNICIPAL DE SAÚDE,FILOMENA REVERS - FISCAL SANITÁRIO E MEIO AMBIENTE,26/06/2017,6150303_448114.pdf
2017-08-11 09:47:20,LINHA DOIS CAMPOERE,,Erechim,11,,112,23/06/2017,SAC,NÃO,,NÃO,SIM,FILOMENA REVERS,FISCAL SANITÁRIO E MEIO AMBIENTE,SECRETÁRIA MUNICIPAL DE SAÚDE,FILOMENA REVERS - FISCAL SANITÁRIO E MEIO AMBIENTE,26/06/2017,6150327_448114.pdf
2017-08-11 09:52:00,LINHA ESCOLA BRANCA,,Erechim,11,,202,22/05/2017,SAC,SIM,VANESSA RITTER,SIM,SIM,FILOMENA REVERS,FISCAL SANITÁRIO E MEIO AMBIENTE,SECRETÁRIA MUNICIPAL DE SAÚDE,FILOMENA REVERS - FISCAL SANITÁRIO E MEIO AMBIENTE,07/06/2017,6150381_448114.pdf
2017-08-11 09:54:36,LINHA FASSICOLO,,Erechim,11,,46,22/06/2017,SAC,NÃO,,NÃO,SIM,FILOMENA REVERS,FISCAL SANITÁRIO E MEIO AMBIENTE,SECRETÁRIA MUNICIPAL DE SAÚDE,FILOMENA REVERS - FISCAL SANITÁRIO E MEIO AMBIENTE,26/06/2017,6150415_448114.pdf
2017-08-11 09:57:59,LINHA HORTO FLORESTAL,,Erechim,11,,31,25/05/2017,SAC,SIM,VANESSA RITTER,SIM,SIM,FILOMENA REVERS,FISCAL SANITÁRIO E MEIO AMBIENTE,SECRETÁRIA MUNICIPAL DE SAÚDE,FILOMENA REVERS - FISCAL SANITÁRIO E MEIO AMBIENTE,07/06/2017,6150452_448114.pdf
2017-08-11 10:00:26,LINHA JAGUARETê,,Erechim,11,,58,21/06/2017,SAC,NÃO,,NÃO,SIM,FILOMENA REVERS,FISCAL SANITÁRIO E MEIO AMBIENTE,SECRETÁRIA MUNICIPAL DE SAÚDE,FILOMENA REVERS - FISCAL SANITÁRIO E MEIO AMBIENTE,26/06/2017,6150473_448114.pdf
2017-08-11 10:03:05,LINHA KM DEZ ARGENTA,,Erechim,11,,256,25/05/2017,SAC,SIM,VANESSA RITTER,SIM,SIM,FILOMENA REVERS,FISCAL SANITÁRIO E MEIO AMBIENTE,SECRETÁRIA MUNICIPAL DE SAÚDE,FILOMENA REVERS - FISCAL SANITÁRIO E MEIO AMBIENTE,07/06/2017,6150503_448114.pdf
2017-08-11 10:07:27,LINHA KM DEZ DOURADO,,Erechim,11,,77,26/06/2017,SAC,NÃO,,NÃO,SIM,FILOMENA REVERS,FISCAL SANITÁRIO E MEIO AMBIENTE,SECRETÁRIA MUNICIPAL DE SAÚDE,FILOMENA REVERS - FISCAL SANITÁRIO E MEIO AMBIENTE,26/06/2017,6150539_448114.pdf
2017-08-11 10:09:52,LINHA KM QUATORZE - PANSERA,,Erechim,11,,39,22/06/2017,SAC,NÃO,,NÃO,SIM,FILOMENA REVERS,FISCAL SANITÁRIO E MEIO AMBIENTE,SECRETÁRIA MUNICIPAL DE SAÚDE,FILOMENA REVERS - FISCAL SANITÁRIO E MEIO AMBIENTE,26/06/2017,6150553_448114.pdf
2017-08-11 10:12:48,LINHA KM SEIS- VILA TRENTIM,,Erechim,11,,11,23/05/2017,SAC,SIM,VANESSA RITTER,SIM,SIM,FILOMENA REVERS,FISCAL SANITÁRIO E MEIO AMBIENTE,SECRETÁRIA MUNICIPAL DE SAÚDE,FILOMENA REVERS - FISCAL SANITÁRIO E MEIO AMBIENTE,07/06/2017,6150583_448114.pdf
2017-08-11 10:15:58,LINHA KM SEIS - POVOADO RIGO,,Erechim,11,,93,26/06/2017,SAC,NÃO,,NÃO,SIM,FILOMENA REVERS,FISCAL SANITÁRIO E MEIO AMBIENTE,SECRETÁRIA MUNICIPAL DE SAÚDE,FILOMENA REVERS - FISCAL SANITÁRIO E MEIO AMBIENTE,26/06/2017,6150610_448114.pdf
2017-08-11 10:19:12,LINHA KM SETE - BARRAGEM CORSAN,,Erechim,11,,373,30/05/2017,SAC,SIM,VANESSA RITTER,SIM,SIM,FILOMENA REVERS,FISCAL SANITÁRIO E MEIO AMBIENTE,SECRETÁRIA MUNICIPAL DE SAÚDE,FILOMENA REVERS - FISCAL SANITÁRIO E MEIO AMBIENTE,07/06/2017,6150640_448114.pdf
2017-08-11 10:20:56,SAC,,Água Santa,6,,19,07/08/2017,SAC,NÃO,,NÃO,SIM,Elis Cristina Biazus,Vigilante Sanitária,Secretaria Municipal de Saúde Água Santa,Elis Cristina Biazus – Vigilante SanitáriaElize Meneghini – Agente de EndemiasMirian da Silveira – Agente de Endemias ,11/08/2017,6150657_448114.doc
2017-08-11 10:21:27,LINHA MOSQUITO,,Erechim,11,,6,21/06/2017,SAC,NÃO,,NÃO,NÃO,FILOMENA REVERS,FISCAL SANITÁRIO E MEIO AMBIENTE,SECRETÁRIA MUNICIPAL DE SAÚDE,FILOMENA REVERS - FISCAL SANITÁRIO E MEIO AMBIENTE,26/06/2017,6150662_448114.pdf
2017-08-11 10:23:14,LINHA PECCIN,,Erechim,11,,31,03/07/2017,SAC,NÃO,,NÃO,SIM,FILOMENA REVERS,FISCAL SANITÁRIO E MEIO AMBIENTE,SECRETÁRIA MUNICIPAL DE SAÚDE,FILOMENA REVERS - FISCAL SANITÁRIO E MEIO AMBIENTE,07/07/2017,6150683_448114.pdf
2017-08-11 10:26:23,LINHA RIO VERDE (PARTE BAIXA),,Erechim,11,,31,27/06/2017,SAC,NÃO,,NÃO,SIM,FILOMENA REVERS,FISCAL SANITÁRIO E MEIO AMBIENTE,SECRETÁRIA MUNICIPAL DE SAÚDE,FILOMENA REVERS - FISCAL SANITÁRIO E MEIO AMBIENTE,30/06/2017,6150715_448114.pdf
2017-08-11 10:29:02,LINHA SÃO JOÃO DO GOVERNO,,Erechim,11,,77,27/06/2017,SAC,NÃO,,NÃO,SIM,FILOMENA REVERS,FISCAL SANITÁRIO E MEIO AMBIENTE,SECRETÁRIA MUNICIPAL DE SAÚDE,FILOMENA REVERS - FISCAL SANITÁRIO E MEIO AMBIENTE,30/06/2017,6150742_448114.pdf
2017-08-11 10:31:17,LINHA SETE DE SETEMBRO,,Erechim,11,,54,27/06/2017,SAC,NÃO,,NÃO,SIM,FILOMENA REVERS,FISCAL SANITÁRIO E MEIO AMBIENTE,SECRETÁRIA MUNICIPAL DE SAÚDE,FILOMENA REVERS - FISCAL SANITÁRIO E MEIO AMBIENTE,30/06/2017,6150779_448114.pdf
2017-08-11 13:43:59,SAC,,Tapejara,6,,21529,17/07/2017,SAC,NÃO,,SIM,SIM,Amanda Cristina Negri,Coord. Vigilância Ambiental em Saúde,Secretaria Municipal da Saúde,Amanda Cristina Negri - Coord. Vigilância Ambiental em Saúde,10/08/2017,6152287_448114.doc
2017-08-11 15:04:19,VILA CRUZ,,Nova Palma,4,,150,24/07/2017,SAC,NÃO,,SIM,SIM,LEONIRA CORTEZ MAZZARDO,FISCAL SANITARIO - VISA E VIGIAGUA/SMSAS,SECRETARIA MUNICIPAL DE SAÚDE E ASSISTÊNCIA SOCIAL,LEONIRA CORTEZ MAZZARDO - VISA - SMSAS,11/08/2017,6152949_448114.pdf
2017-08-14 09:09:03 (2017-08-03 15:45:56),SAC ARABELA,,São Paulo das Missões,14,,111,28/07/2017,SAC,NÃO,,NÃO,,Marcia Weyh Werle Tozevich,Fiscal Municipal,Prefeitura Municipal de São Paulo das Missões,Marcia Weyh Werle Tozevich fiscal municipal,03/08/2017,6107842_448114.pdf
2017-08-14 15:16:03,PTP São Paulo,,Estação,11,,36,12/07/2017,SAC,SIM,Vanessa Dos Santos Ritter,SIM,SIM,Kelin Vechiatto,Agente de Fiscalização,Secretaria Municipal de Saúde,,14/08/2017,6161533_448114.pdf
2017-08-14 15:48:03,PTP Bresolin,,Estação,11,,86,12/07/2017,SAC,SIM,Vanessa Dos Santos Ritter,SIM,NÃO,KELIN VECHIATTO,Agente de Fiscalização,Secretaria Municipal de Saúde,,14/08/2017,6162007_448114.pdf
2017-08-15 09:22:32,POÇO LINHA COXILHA,,Barão de Cotegipe,11,,75,12/08/2017,SAC,SIM,VERA LUCIA RIZZI DAL PUPO,SIM,SIM,Silvana Trierveiler,COORDENADORA DA VISA,SECRETARIA DA SAÚDE,SILVANA TRIERVEILER- COORDENADORA DA VISAMARCOS BEVILAQUA - FISCAL SANITÁRIO,15/08/2017,6165288_448114.pdf
2017-08-15 16:17:16,DOIS ARROIOS,,Severiano de Almeida,11,,27,10/08/2017,SAC,NÃO,,NÃO,,Alan Junior Solivo,Fiscal Sanitário,Secretaria Municipal de Saúde,ALAN JUNIOR SOLIVOLUCAS EDUARDO RIBEIRO,14/08/2017,6169947_448114.pdf
2017-08-15 16:20:14,LINHA NORTE,,Severiano de Almeida,11,,91,10/08/2017,SAC,NÃO,,NÃO,,Alan Junior Solivo,Fiscal Sanitário,Secretaria Municipal de Saúde,ALAN JUNIOR SOLIVOLUCAS EDUARDO RIBEIRO,14/08/2017,6169981_448114.pdf
2017-08-15 16:24:56,LAMBEDOR I,,Severiano de Almeida,11,,33,10/08/2017,SAC,NÃO,,NÃO,,Alan Junior Solivo,Fiscal Sanitário,Secretaria Municipal de Saúde,ALAN JUNIOR SOLIVOLUCAS EDUARDO RIBEIRO,14/08/2017,6170045_448114.pdf
2017-08-16 09:32:46,LINHA DUAS NOSSA SENHORA DAS GRAÇAS,,Barão de Cotegipe,11,,53,14/08/2017,SAC,NÃO,,NÃO,SIM,Silvana Trierveiler,COORDENADORA VISA,PREFEITURA DE BARÃO DE COTEGIPE-SECRETARIA DA SAÚDE,SILVANA TRIERVEILERMARCOS BEVILAQUA,16/08/2017,6173352_448114.pdf
2017-08-16 09:47:14 (2017-08-16 09:40:46),Rio dos Índios II,,Centenário,11,,50,25/07/2017,SAC,SIM,Marta Menosso Acorsi,SIM,NÃO,Janalice Ana Kessler,Agente de Combate a Endemias,Secretaria Municipal da Saúde,Graciele Butrinoski -Fiscal SanitárioJanalice Ana Kessler - Agente de Combate a Endemias,16/08/2017,6173443_448114.docx
2017-08-16 10:57:58,PTP Associação Linha 4,,Estação,11,,59,04/08/2017,SAC,SIM,Vanessa Dos Santos Ritter,SIM,NÃO,Kelin Vechiatto,Agente de Fiscalização,Secretaria Municipal de Saúde,,04/08/2017,6174267_448114.pdf
2017-08-16 11:57:23,SAC LINHA MONTE ALEGRE,,Barão de Cotegipe,11,,75,14/08/2017,SAC,NÃO,,NÃO,SIM,Silvana Trierveiler,COORDENADORA VISA,PREFEITURA DE BARÃO DE COTEGIPE-SECRETARIA DA SAÚDE,SILVANA TRIERVEILER- COORDENADORA- VISAMARCOS BEVILAQUA- FISCAL SANITÁRIO,16/08/2017,6174837_448114.pdf
2017-08-16 15:28:13 (2017-08-03 15:56:52),LINHA PROGRESSO,,Alecrim,14,,43,11/07/2017,SAC,NÃO,,NÃO,,GIRNEI LUIS DIRINGS,FISCAL SANITARIO,SECRETARIA MUNICIPAL DE SAÚDE,GIRNEI LUIS DIRINGSFISCAL SANITÁRIO,03/08/2017,6107964_448114.pdf
2017-08-16 15:39:57 (2017-08-03 14:43:16), ALTO BIGUA,,Alecrim,14,,154,11/07/2017,SAC,NÃO,,NÃO,,GIRNEI LUIS DIRINGS,FISCAL SANITARIO,SECRETARIA MUNICIPAL DE SAÚDE,GIRNEI LUIS DIRINGSFISCAL SANITÁRIO,03/08/2017,6107061_448114.pdf
2017-08-16 15:49:50 (2017-08-03 16:12:55),PORTO BIGUA,,Alecrim,14,,77,11/07/2017,SAC,NÃO,,NÃO,,GIRNEI LUIS DIRINGS,FISCAL SANITARIO,SECRETARIA MUNICIPAL DE SAÚDE,GIRNEI LUIS DIRINGSFISCAL SANITARIO,03/08/2017,6108153_448114.pdf
2017-08-16 16:18:51 (2017-08-08 15:16:43),LAJEADO MORCEGO,,Alecrim,14,,66,11/07/2017,SAC,NÃO,,NÃO,,GIRNEI LUIS DIRINGS,FISCAL SANITARIO,SECRETARIA MUNICIPAL DE SAÚDE,GIRNEI LUIS DIRINGSFISCAL SANITARIO,08/08/2017,6132009_448114.pdf
2017-08-17 08:05:22,SAC,,Tapejara,6,,12,10/08/2017,SAC,NÃO,,SIM,SIM,Amanda Cristina Negri,Coord. Vigilância Ambiental em Saúde,Secretaria Municipal da Saúde,Amanda Cristina Negri - Coord. Dept. Vigilância ,16/08/2017,6178520_448114.doc
2017-08-17 08:24:24 (2017-08-08 15:12:34),ALTO MORCEGO,,Alecrim,14,,134,11/07/2017,SAC,NÃO,,NÃO,,GIRNEI LUIS DIRINGS,FISCAL SANITARIO,SECRETARIA MUNICIPAL DE SAÚDE,GIRNEI LUIS DIRINGSFISACAL SANITARIO,08/08/2017,6131945_448114.pdf
2017-08-17 08:38:57 (2017-08-08 15:30:15),ESQUINA ABELHA,,Alecrim,14,,,11/07/2017,SAC,NÃO,,NÃO,,GIRNEI LUIS DIRINGS,FISCAL SANITARIO,SECRETARIA MUNICIPAL DE SAÚDE,GIRNEI LUIS DIRINGSFISCAL SANITARIO,08/08/2017,6132193_448114.pdf
2017-08-17 08:47:26 (2017-08-08 15:27:19),LAJEADO PEDREGULHO,,Alecrim,14,,100,11/07/2017,SAC,NÃO,,NÃO,,GIRNEI LUIS DIRINGS,FISCAL SANITARIO,SECRETARIA MUNICIPAL DE SAÚDE,GIRNEI LUIS DIRINGSFISCAL SANITARIO,08/08/2017,6132155_448114.pdf
2017-08-17 09:27:16,SAC RINCÃO MACIEL 2,,Giruá,14,,32,16/08/2017,SAC,NÃO,,NÃO,NÃO,LUIZ FERNANDO SCHWERZ,FISCAL SANITARIO,SECRETARIA MUNICIPAL DE SAÚDE,LUIZ FERNANDO SCHWERZ - FISCAL SANITÁRIORICARDO FERNANDO THOM - AGENTE SANITARISTA,,6179245_448114.pdf
2017-08-17 10:16:37,SAC BOCA DA PICADA 3,,Giruá,14,,64,16/08/2017,SAC,NÃO,,NÃO,NÃO,LUIZ FERNANDO SCHWERZ,FISCAL SANITARIO,SECRETARIA MUNICIPAL DE SAÚDE,LUIZ FERNANDO SCHWERZ - FISCAL SANITÁRIORICARDO FERNANDO THOM - AGENTE SANITARISTA,,6179818_448114.pdf
2017-08-17 10:52:26,SAC BOCA DA PICADA 4,,Giruá,14,,47,16/08/2017,SAC,NÃO,,NÃO,NÃO,LUIZ FERNANDO SCHWERZ,FISCAL SANITARIO,SECRETARIA MUNICIPAL DE SAÚDE,LUIZ FERNANDO SCHWERZ - FISCAL SANITÁRIORICARDO FERNANDO THOM - AGENTE SANITARISTA,,6180199_448114.pdf
2017-08-18 08:23:07,Sistema Municipal de Vale Real,,Vale Real,5,,5594,16/08/2017,SAA,SIM,Marines Nodari,SIM,SIM,Alessandro Vanoni,Vigilante Sanitário,Secretaria Municipal da Saúde/Vigilância Sanitária,Alessandro VanoniVigikante Sanitário,18/08/2017,6183881_448114.docx
2017-08-18 09:19:45,SAC QUEBRADA,,Caraã,18,,400,16/01/2017,SAC,SIM,MARCOS ALBERTO BEUBALDT,SIM,SIM,DAVID HLBARENHO,COORDENADOR REGIONAL VIGIAGUA,18 º CRS,MOISES DOS SANTOS  GOMES - FISACAL SANITARIODAVID  HERNANI LEONETTI BARENHO - COORDENADOR VIGIAGUA,25/01/2017,
2017-08-18 10:43:20,SÃO VALENTIM,,Alecrim,14,,103,10/08/2017,SAC,NÃO,,NÃO,,GIRNEI LUIS DIRINGS,FISCAL SANITARIO,SECRETARIA MUNICIPAL DE SAÚDE,GIRNEI LUIS DIRINGSFISCAL SANITÁRIO,18/08/2017,6185187_448114.pdf
2017-08-21 08:52:38,Linha Scheid - São Miguel,,Nova Candelária,14,,45 ,16/08/2017,SAC,SIM,Norton Augusto Martini Filipin,SIM,NÃO,Luana Vanessa Schwarzer,Vigilância Sanitária,Secretaria de Saúde,Luana Schwarzer = Vigilância Sanitária,22/08/2017,
2017-08-22 08:02:25,SANTA CRUZ 1,,São Jorge,5,,61,18/08/2017,SAC,SIM,Oberdan Fiorentin,SIM,NÃO,Jovane,Vigilante Sanitário,Secretaria Municipal da Saúde,Nileide Marques Richetti - Auxiliar de Vigilancia Sanitária,21/08/2017,
2017-08-22 08:16:27,SANTA CRUZ 2,,São Jorge,5,,55,18/08/2017,SAC,SIM,Oberdan Fiorentin,SIM,NÃO,Jovane,Vigilante Sanitário,Secretaria Municipal da Saúde,Nileide Marques Richetti - Auxiliar de Vigilancia Sanitária,21/08/2017,
2017-08-22 08:28:43,SÃO CAETANO,,São Jorge,5,,52,18/08/2017,SAC,SIM,Oberdan Fiorentin,SIM,NÃO,Jovane Trevisan,Vigilante Sanitário,Secretaria Municipal da Saúde,Nileide Marques Richetti - Auxiliar de Vigilância Sanitária,21/08/2017,
2017-08-22 08:42:50,SÃO MARCOS,,São Jorge,5,,207,18/08/2017,SAC,SIM,Oberdan Fiorentin,SIM,NÃO,Jovane Trevisan,Vigilante Sanitário,Secretaria Municipal da Saúde,Nileide Marques Richetti - Auxiliar de Vigilancia Sanitária,21/08/2017,
2017-08-22 08:46:28,NOSSA SENHORA DE FÁTIMA,,São Jorge,5,,46,18/08/2017,SAC,SIM,Oberdan Fiorentin,SIM,NÃO,Jovane Trevisan,Vigilante Sanitário,Secretaria Municipal da Saúde,Nileide Marques Richetti - Auxiliar de Vigilância Sanitária,21/08/2017,
2017-08-22 08:49:48,SANTA CRUZ 3,,São Jorge,5,,43,18/08/2017,SAC,SIM,Oberdan Fiorentin,SIM,NÃO,Jovane Trevisan,Vigilante Sanitário,Secretaria Municipal da Saúde,NILEIDE MARQUES RICHETTI - AUXILIAR DE VIGILÂNCIA SANITÁRIA,21/08/2017,
2017-08-22 09:03:19,ESQUINA GUIA LOPES KM 2,,Santa Rosa,14,,303,13/07/2017,SAC,NÃO,,SIM,NÃO,NEIVA LAVALL REX,AGENTE SANITÁRIO,FUNDAÇÃO MUNICIPAL DE SAÚDE,NEIVA LAVALL REX - AGENTE SANITÁRIO,22/08/2017,6196746_448114.pdf
2017-08-22 09:04:19,SÃO SEBASTIÃO,,Alecrim,14,,162,11/07/2017,SAC,NÃO,,NÃO,,GIRNEI LUIS DIRINGS,FISCAL SANITARIO,SECRETARIA MUNICIPAL DE SAÚDE,GIRNEI LUIS DIRINGSFISCAL SANITÁRIO,22/08/2017,6196754_448114.pdf
2017-08-22 09:14:39,LAJEADO TARAÍRA,,Alecrim,14,,,11/07/2017,SAC,NÃO,,NÃO,,GIRNEI LUIS DIRINGS,FISCAL SANITARIO,SECRETARIA MUNICIPAL DE SAÚDE,GIRNEI LUIS DIRINGSFISCAL SANITARIO,22/08/2017,6196851_448114.pdf
2017-08-22 09:18:18 (2017-08-03 15:07:40),LOTEAMENTO ESQUINA GUIA LOPES ,,Santa Rosa,14,,144,11/07/2017,SAC,NÃO,,NÃO,NÃO,neiva lavall rex,AGENTE SANITÁRIO,FUNDAÇÃO MUNICIPAL DE SAÚDE,NEIVA LAVALL REX,03/08/2017,6107352_448114.pdf
2017-08-22 09:19:52 (2017-08-03 15:12:36),ACAPIB-ASSOCIAÇÃO DOS CONSUMIDORES DE ÁGUA IPE BAIXO,,Santa Rosa,14,,200,13/07/2017,SAC,NÃO,,NÃO,,neiva lavall rex,agente sanitário,FUNDAÇÃO MUNICIPAL DE SAÚDE,NEIVA LAVALL REX ,03/08/2017,6107408_448114.pdf
2017-08-22 09:19:58,LAJEADO CHIMÃ,,Alecrim,14,,,11/07/2017,SAC,NÃO,,NÃO,,GIRNEI LUIS DIRINGS,FISCAL SANITARIO,SECRETARIA MUNICIPAL DE SAÚDE,GIRNEI LUIS DIRINGSFISCAL SANITARIO,22/08/2017,6196888_448114.pdf
2017-08-22 09:22:03 (2017-08-04 12:37:41),LINHA ESQUINA GUIA LOPES KM 4,,Santa Rosa,14,,77,11/07/2017,SAC,NÃO,,NÃO,,NEIVA LAVALL REX,AGENTE SANITÁRIO,FUNDAÇÃO MUNICIPAL DE SAÚDE,NEIVA LAVALL REX,03/08/2017,6112678_448114.pdf
2017-08-22 09:58:34,Associação Comunitária Flor de Maio,,Independência,14,,35,21/08/2017,SAC,NÃO,,NÃO,SIM,KLEBER JUNG,ENFERMEIRO/VIGILÂNCIA EM SAÚDE,SECRETARIA MUNICIPAL DE SAÚDE DE INDEPENDÊNCIA,KLEBER JUNG - ENFERMEIRO,31/08/2017,6197282_448114.pdf
2017-08-22 10:05:38,ESQUINA VANGUARDA,,Alecrim,14,,245,11/07/2017,SAC,NÃO,,NÃO,,GIRNEI LUIS DIRINGS,FISCAL SANITÁRIO,SECRETARIA MUNICIPAL DE SAÚDE,GIRNEI LUIS DIRINGSFISCAL SANITÁRIO,22/08/2017,6197361_448114.pdf
2017-08-22 10:13:13,SÃO VALENTIM,,Alecrim,14,,103,10/08/2017,SAC,NÃO,,NÃO,,GIRNEI LUIS DIRINGS,FISCAL SANITÁRIO,SECRETARIA MUNICIPAL DE SAÚDE,GIRNEI LUIS DIRINGSFISCAL SANITÁRIO,22/08/2017,6197428_448114.pdf
2017-08-22 10:16:50,Associação Comunitária Pessegueirinho,,Independência,14,,34,21/08/2017,SAC,NÃO,,NÃO,SIM,KLEBER JUNG,ENFERMEIRO/VIGILÂNCIA EM SAÚDE,SECRETARIA MUNICIPAL DE SAÚDE DE INDEPENDÊNCIA,KLEBER JUNG - ENFERMEIRO,31/08/2017,6197460_448114.pdf
2017-08-22 10:21:10,LAJEADO ALECRIM,,Alecrim,14,,171,10/08/2017,SAC,NÃO,,NÃO,,GIRNEI LUIS DIRINGS,FISCAL SANITÁRIO,SECRETARIA MUNICIPAL DE SAÚDE,GIRNEI LUIS DIRINGSFISCAL SANITÁRIO,22/08/2017,6197491_448114.pdf
2017-08-22 10:36:27,Associação Comunitária Mormaço,,Independência,14,,45,21/08/2017,SAC,NÃO,,NÃO,SIM,KLEBER JUNG,ENFERMEIRO/VIGILÂNCIA EM SAÚDE,SECRETARIA MUNICIPAL DE SAÚDE DE INDEPENDÊNCIA,Kleber Jung - Enfermeiro,31/08/2017,6197648_448114.pdf
2017-08-22 14:02:25,LINHA ALECRIM,,Alecrim,14,,54,10/08/2017,SAC,NÃO,,NÃO,,GIRNEI LUIS DIRINGS,FISCAL SANITARIO,SECRETARIA MUNICIPAL DE SAÚDE,GIRNEI LUIS DIRINGSFISCAL SANITÁRIO,22/08/2017,6199154_448114.pdf
2017-08-22 14:11:09,ESQUINA SANTO ANTONIO,,Alecrim,14,,177,10/08/2017,SAC,NÃO,,NÃO,,GIRNEI LUIS DIRINGS,FISCAL SANITÁRIO,SECRETARIA MUNICIPAL DE SAÚDE,GIRNEI LUIS DIRINGSFISCAL SANITÁRIO,22/08/2017,6199235_448114.pdf
2017-08-22 14:26:19,LAJEADO PARAÍSO,,Alecrim,14,,97,09/08/2017,SAC,NÃO,,NÃO,,GIRNEI LUIS DIRINGS,FISCAL SANITÁRIO,SECRETARIA MUNICIPAL DE SAÚDE,GIRNEI LUIS DIRINGSFISCAL SNITÁRIO,22/08/2017,6199360_448114.pdf
2017-08-22 14:37:13,BARRA DO PATOS,,Alecrim,14,,,09/08/2017,SAC,NÃO,,NÃO,,GIRNEI LUIS DIRINGS,FISCAL SANITÁRIO,SECRETARIA MUNICIPAL DE SAÚDE,GIRNEI LUIS DIRINGSFISCAL SANITARIO,22/08/2017,6199447_448114.pdf
2017-08-22 14:43:11,LAJEADO PATOS,,Alecrim,14,,51,09/08/2017,SAC,NÃO,,NÃO,,GIRNEI LUIS DIRINGS,FISCAL SANITÁRIO,SECRETARIA MUNICIPAL DE SAÚDE,GIRNEI LUIS DIRINGSFISCAL SANITÁRIO,22/08/2017,6199515_448114.pdf
2017-08-22 14:51:19,ESQUINA PATOS,,Alecrim,14,,74,09/08/2017,SAC,NÃO,,NÃO,,GIRNEI LUIS DIRINGS,FISCAL SANITÁRIO,SECRETARIA MUNICIPAL DE SAÚDE,GIRNEI LUIS DIRINGSFISCAL SANITÁRIO,22/08/2017,6199592_448114.pdf
2017-08-22 14:57:27,LINHA PATOS,,Alecrim,14,,60,09/08/2017,SAC,NÃO,,NÃO,,GIRNEI LUIS DIRINGS,FISCAL SANITÁRIO,SECRETARIA MUNICIPAL DE SAÚDE,GIRNEI LUIS DIRINGSFISCAL SANITARIO,22/08/2017,6199649_448114.pdf
2017-08-22 15:33:59,LAJEADO SEGREDO,,Alecrim,14,,31,09/08/2017,SAC,NÃO,,NÃO,,GIRNEI LUIS DIRINGS,FISCAL SANITÁRIO,SECRETARIA MUNICIPAL DE SAÚDE,GIRNEI LUIS DIRINGSFISCAL SANITÁRIO,22/08/2017,6200002_448114.pdf
2017-08-23 08:20:27,ESQUINA SÃO PEDRO,,Alecrim,14,,,18/08/2017,SAC,NÃO,,NÃO,,GIRNEI LUIS DIRINGS,FISCAL SANITÁRIO,SECRETARIA MUNICIPAL DE SAÚDE,GIRNEI LUIS DIRINGSFISCAL SANITÁRIO,23/08/2017,6201897_448114.pdf
2017-08-23 08:26:05,POÇO PRETO,,Alecrim,14,,57,18/08/2017,SAC,NÃO,,NÃO,,GIRNEI LUIS DIRINGS,FISCAL SANITÁRIO,SECRETARIA MUNICIPAL DE SAÚDE,GIRNEI LUIS DIRINGSFISCAL SANITÁRIO,23/08/2017,6201931_448114.pdf
2017-08-23 08:30:51,LAJEADO PILÃO,,Alecrim,14,,242,18/08/2017,SAC,NÃO,,NÃO,,GIRNEI LUIS DIRINGS,FISCAL SANITÁRIO,SECRETARIA MUNICIPAL DE SAÚDE,GIRNEI LUIS DIRINGSFISCAL SANITÁRIO,23/08/2017,6201966_448114.pdf
2017-08-23 08:39:49,BARRA DO SANTO CRISTO,,Alecrim,14,,157,18/08/2017,SAC,NÃO,,NÃO,,GIRNEI LUIS DIRINGS,FISCAL SANITÁRIO,SECRETARIA MUNICIPAL DE SAÚDE,GIRNEI LUIS DIRINGSFISCAL SANITÁRIO,23/08/2017,6202030_448114.pdf
